bhsa_node,ref,sentence,text_full,lxx,lxx_tm,esv,esv_TAM,esv_verse,niv,niv_TAM,niv_verse
237836,Jeremiah 6:11,וְאֵת֩ חֲמַ֨ת יְהוָ֤ה׀ מָלֵ֨אתִי֙ ,מָלֵ֨אתִי֙,ἔπλησα,aorist indc,I am full of,PRES..IND,"Therefore I am full of the wrath of the Lord ; I am weary of holding it in . “ Pour it out upon the children in the street , and upon the gatherings of young men , also ; both husband and wife shall be taken , the elderly and the very aged .",I am full of,PRES..IND,"But I am full of the wrath of the LORD , and I cannot hold it in . “ Pour it out on the children in the street and on the young men gathered together ; both husband and wife will be caught in it , and the old , those weighed down with years ."
237837,Jeremiah 6:11,נִלְאֵ֣יתִי הָכִ֔יל ,נִלְאֵ֣יתִי,ἐπέσχον,aorist indc,I am weary,PRES..IND,"Therefore I am full of the wrath of the Lord ; I am weary of holding it in . “ Pour it out upon the children in the street , and upon the gatherings of young men , also ; both husband and wife shall be taken , the elderly and the very aged .",I cannot,PRES..MOD,"But I am full of the wrath of the LORD , and I cannot hold it in . “ Pour it out on the children in the street and on the young men gathered together ; both husband and wife will be caught in it , and the old , those weighed down with years ."
237932,Jeremiah 6:15,אָמַ֥ר יְהוָֽה׃ ס ,אָמַ֥ר,εἶπεν,aorist indc,says,PRES..IND,"Were they ashamed when they committed abomination ? No , they were not at all ashamed ; they did not know how to blush . Therefore they shall fall among those who fall ; at the time that I punish them , they shall be overthrown , ” says the Lord .",says,PRES..IND,"Are they ashamed of their loathsome conduct ? No , they have no shame at all ; they do not even know how to blush . So they will fall among the fallen ; they will be brought down when I punish them , ” says the LORD ."
238103,Jeremiah 6:24,רָפ֣וּ יָדֵ֑ינוּ ,רָפ֣וּ,παρελύθησαν,aorist indc,fall helpless,PRES..IND,"We have heard the report of it ; our hands fall helpless ; anguish has taken hold of us , pain as of a woman in labor .",hang limp,PRES..IND,"We have heard reports about them , and our hands hang limp . Anguish has gripped us , pain like that of a woman in labour ."
238171,Jeremiah 6:29,נָחַ֣ר מַפֻּ֔חַ מֵאֵ֖שׁ תַּ֣ם ,נָחַ֣ר,ἐξέλιπεν,aorist indc,blow fiercely,PRES..IND,"The bellows blow fiercely ; the lead is consumed by the fire ; in vain the refining goes on , for the wicked are not removed .",blow fiercely,PRES..IND,"The bellows blow fiercely to burn away the lead with fire , but the refining goes on in vain ; the wicked are not purged out ."
238185,Jeremiah 6:29,וְרָעִ֖ים לֹ֥א נִתָּֽקוּ׃ ,נִתָּֽקוּ,ἐτάκη,aorist indc,are removed,PRES..IND,"The bellows blow fiercely ; the lead is consumed by the fire ; in vain the refining goes on , for the wicked are not removed .",are purged out,PRES..IND,"The bellows blow fiercely to burn away the lead with fire , but the refining goes on in vain ; the wicked are not purged out ."
239078,Jeremiah 8:5,הֶחֱזִ֨יקוּ֙ בַּתַּרְמִ֔ית ,הֶחֱזִ֨יקוּ֙,κατεκρατήθησαν,aorist indc,They hold fast,PRES..IND,Why then has this people turned away in perpetual backsliding ? They hold fast to deceit ; they refuse to return .,They cling,PRES..IND,Why then have these people turned away ? Why does Jerusalem always turn away ? They cling to deceit ; they refuse to return .
239082,Jeremiah 8:5,מֵאֲנ֖וּ לָשֽׁוּב׃ ,מֵאֲנ֖וּ,ἠθέλησαν,aorist indc,they refuse,PRES..IND,Why then has this people turned away in perpetual backsliding ? They hold fast to deceit ; they refuse to return .,they refuse,PRES..IND,Why then have these people turned away ? Why does Jerusalem always turn away ? They cling to deceit ; they refuse to return .
239115,Jeremiah 8:7,גַּם־חֲסִידָ֣ה בַשָּׁמַ֗יִם יָֽדְעָה֙ מֹֽועֲדֶ֔יהָ ,יָֽדְעָה֙,ἔγνω,aorist indc,knows,PRES..IND,"Even the stork in the heavens knows her times , and the turtledove , swallow , and crane keep the time of their coming , but my people know not the rules of the Lord .",knows,PRES..IND,"Even the stork in the sky knows her appointed seasons , and the dove , the swift and the thrush observe the time of their migration . But my people do not know the requirements of the LORD ."
239123,Jeremiah 8:7,וְתֹ֤ר וְסִיס֙ וְעָג֗וּר שָׁמְר֖וּ אֶת־עֵ֣ת בֹּאָ֑נָה ,שָׁמְר֖וּ,ἐφύλαξαν,aorist indc,keep,PRES..IMPV,"Even the stork in the heavens knows her times , and the turtledove , swallow , and crane keep the time of their coming , but my people know not the rules of the Lord .",observe,PRES..IND,"Even the stork in the sky knows her appointed seasons , and the dove , the swift and the thrush observe the time of their migration . But my people do not know the requirements of the LORD ."
239130,Jeremiah 8:7,וְעַמִּ֕י לֹ֣א יָֽדְע֔וּ אֵ֖ת מִשְׁפַּ֥ט יְהוָֽה׃ ,יָֽדְע֔וּ,ἔγνω,aorist indc,know,PRES..IND,"Even the stork in the heavens knows her times , and the turtledove , swallow , and crane keep the time of their coming , but my people know not the rules of the Lord .",do know,PRES..IMPV,"Even the stork in the sky knows her appointed seasons , and the dove , the swift and the thrush observe the time of their migration . But my people do not know the requirements of the LORD ."
239359,Jeremiah 8:20,עָבַ֥ר קָצִ֖יר ,עָבַ֥ר,διῆλθεν,aorist indc,is past,PRES..IND,"“ The harvest is past , the summer is ended , and we are not saved . ”",is past,PRES..IND,"“ The harvest is past , the summer has ended , and we are not saved . ”"
239361,Jeremiah 8:20,כָּ֣לָה קָ֑יִץ ,כָּ֣לָה,παρῆλθεν,aorist indc,is ended,PRES..IND,"“ The harvest is past , the summer is ended , and we are not saved . ”",has ended,PRES.PERF.IND,"“ The harvest is past , the summer has ended , and we are not saved . ”"
239366,Jeremiah 8:20,וַאֲנַ֖חְנוּ לֹ֥וא נֹושָֽׁעְנוּ׃ ,נֹושָֽׁעְנוּ,διεσώθημεν,aorist indc,are saved,PRES..IND,"“ The harvest is past , the summer is ended , and we are not saved . ”",are saved,PRES..IND,"“ The harvest is past , the summer has ended , and we are not saved . ”"
239372,Jeremiah 8:21,קָדַ֕רְתִּי ,קָדַ֕רְתִּי,ἐσκοτώθην,aorist indc,I mourn,PRES..IND,"For the wound of the daughter of my people is my heart wounded ; I mourn , and dismay has taken hold on me .",I mourn,PRES..IND,"Since my people are crushed , I am crushed ; I mourn , and horror grips me ."
239387,Jeremiah 8:22,כִּ֗י מַדּ֨וּעַ֙ לֹ֣א עָֽלְתָ֔ה אֲרֻכַ֖ת בַּת־עַמִּֽי׃ ,עָֽלְתָ֔ה,ἀνέβη,aorist indc,has been restored,PRES..IND,Is there no balm in Gilead ? Is there no physician there ? Why then has the health of the daughter of my people not been restored ?,is there,PRES..IND,Is there no balm in Gilead ? Is there no physician there ? Why then is there no healing for the wound of my people ?
239438,Jeremiah 9:2,וְלֹ֥א לֶאֱמוּנָ֖ה גָּבְר֣וּ בָאָ֑רֶץ ,גָּבְר֣וּ,ἐνίσχυσεν,aorist indc,has grown strong,PRES.PERF.IND,"They bend their tongue like a bow ; falsehood and not truth has grown strong in the land ; for they proceed from evil to evil , and they do not know me , declares the Lord .",they triumph,PRES..IND,"“ They make ready their tongue like a bow , to shoot lies ; it is not by truth that they triumph in the land . They go from one sin to another ; they do not acknowledge me , ” declares the LORD ."
239447,Jeremiah 9:2,כִּי֩ מֵרָעָ֨ה אֶל־רָעָ֧ה׀ יָצָ֛אוּ ,יָצָ֛אוּ,ἐξήλθοσαν,aorist indc,they proceed,PRES..IND,"They bend their tongue like a bow ; falsehood and not truth has grown strong in the land ; for they proceed from evil to evil , and they do not know me , declares the Lord .",They go,PRES..IND,"“ They make ready their tongue like a bow , to shoot lies ; it is not by truth that they triumph in the land . They go from one sin to another ; they do not acknowledge me , ” declares the LORD ."
239488,Jeremiah 9:4,הַעֲוֵ֥ה נִלְאֽוּ׃ ,נִלְאֽוּ,διέλιπον,aorist indc,they weary themselves,PRES..IND,"Everyone deceives his neighbor , and no one speaks the truth ; they have taught their tongue to speak lies ; they weary themselves committing iniquity .",they weary themselves,PRES..IND,"Friend deceives friend , and no-one speaks the truth . They have taught their tongues to lie ; they weary themselves with sinning ."
239562,Jeremiah 9:9,כִּ֤י נִצְּתוּ֙ ,נִצְּתוּ֙,ἐξέλιπον,aorist indc,they are laid waste,PRES..IND,"“ I will take up weeping and wailing for the mountains , and a lamentation for the pastures of the wilderness , because they are laid waste so that no one passes through , and the lowing of cattle is not heard ; both the birds of the air and the beasts have fled and are gone .",They are desolate,PRES..IND,"I will weep and wail for the mountains and take up a lament concerning the desert pastures . They are desolate and untravelled , and the lowing of cattle is not heard . The birds of the air have fled and the animals are gone ."
239569,Jeremiah 9:9,וְלֹ֥א שָׁמְע֖וּ קֹ֣ול מִקְנֶ֑ה ,שָׁמְע֖וּ,ἤκουσαν,aorist indc,is heard,PRES..IND,"“ I will take up weeping and wailing for the mountains , and a lamentation for the pastures of the wilderness , because they are laid waste so that no one passes through , and the lowing of cattle is not heard ; both the birds of the air and the beasts have fled and are gone .",is heard,PRES..IND,"I will weep and wail for the mountains and take up a lament concerning the desert pastures . They are desolate and untravelled , and the lowing of cattle is not heard . The birds of the air have fled and the animals are gone ."
239617,Jeremiah 9:11,עַל־מָה֙ אָבְדָ֣ה הָאָ֔רֶץ ,אָבְדָ֣ה,ἀπώλετο,aorist indc,is ruined,PRES..IND,"Who is the man so wise that he can understand this ? To whom has the mouth of the Lord spoken , that he may declare it ? Why is the land ruined and laid waste like a wilderness , so that no one passes through ?",has been ruined,,What man is wise enough to understand this ? Who has been instructed by the LORD and can explain it ? Why has the land been ruined and laid waste like a desert that no-one can cross ?
239734,Jeremiah 9:18,כִּ֣י קֹ֥ול נְהִ֛י נִשְׁמַ֥ע מִצִּיֹּ֖ון ,נִשְׁמַ֥ע,ἠκούσθη,aorist indc,is heard,PRES..IND,"For a sound of wailing is heard from Zion : ‘ How we are ruined ! We are utterly shamed , because we have left the land , because they have cast down our dwellings . ’ ”",is heard,PRES..IND,The sound of wailing is heard from Zion : ‘ How ruined we are ! How great is our shame ! We must leave our land because our houses are in ruins . ’ ”
239738,Jeremiah 9:18,אֵ֣יךְ שֻׁדָּ֑דְנוּ ,שֻׁדָּ֑דְנוּ,ἐταλαιπωρήσαμεν,aorist indc,we are ruined,PRES..IND,"For a sound of wailing is heard from Zion : ‘ How we are ruined ! We are utterly shamed , because we have left the land , because they have cast down our dwellings . ’ ”",ruined we are,PRES..IND,The sound of wailing is heard from Zion : ‘ How ruined we are ! How great is our shame ! We must leave our land because our houses are in ruins . ’ ”
239739,Jeremiah 9:18,בֹּ֤שְׁנֽוּ מְאֹד֙ ,בֹּ֤שְׁנֽוּ,κατῃσχύνθημεν,aorist indc,We are shamed,PRES..IND,"For a sound of wailing is heard from Zion : ‘ How we are ruined ! We are utterly shamed , because we have left the land , because they have cast down our dwellings . ’ ”",shame,,The sound of wailing is heard from Zion : ‘ How ruined we are ! How great is our shame ! We must leave our land because our houses are in ruins . ’ ”
239745,Jeremiah 9:18,כִּ֥י הִשְׁלִ֖יכוּ מִשְׁכְּנֹותֵֽינוּ׃ ס ,הִשְׁלִ֖יכוּ,ἀπερρίψαμεν,aorist indc,they have cast down,PRES.PERF.IND,"For a sound of wailing is heard from Zion : ‘ How we are ruined ! We are utterly shamed , because we have left the land , because they have cast down our dwellings . ’ ”",are in ruins,PRES..IND,The sound of wailing is heard from Zion : ‘ How ruined we are ! How great is our shame ! We must leave our land because our houses are in ruins . ’ ”
239907,Jeremiah 10:1,שִׁמְע֣וּ אֶת־הַדָּבָ֗ר אֲשֶׁ֨ר דִּבֶּ֧ר יְהוָ֛ה עֲלֵיכֶ֖ם בֵּ֥ית יִשְׂרָאֵֽל׃ ,דִּבֶּ֧ר,ἐλάλησεν,aorist indc,speaks,PRES..IND,"Hear the word that the Lord speaks to you , O house of Israel .",says,PRES..IND,"Hear what the LORD says to you , O house of Israel ."
240124,Jeremiah 10:13,בְּרָקִ֤ים לַמָּטָר֙ עָשָׂ֔ה ,עָשָׂ֔ה,ἐποίησεν,aorist indc,He makes,PRES..IND,"When he utters his voice , there is a tumult of waters in the heavens , and he makes the mist rise from the ends of the earth . He makes lightning for the rain , and he brings forth the wind from his storehouses .",He sends,PRES..IND,"When he thunders , the waters in the heavens roar ; he makes clouds rise from the ends of the earth . He sends lightning with the rain and brings out the wind from his storehouses ."
240130,Jeremiah 10:14,נִבְעַ֤ר כָּל־אָדָם֙ מִדַּ֔עַת ,נִבְעַ֤ר,ἐμωράνθη,aorist indc,is stupid,PRES..IND,"Every man is stupid and without knowledge ; every goldsmith is put to shame by his idols , for his images are false , and there is no breath in them .",is senseless,PRES..IND,Everyone is senseless and without knowledge ; every goldsmith is shamed by his idols . His images are a fraud ; they have no breath in them .
240135,Jeremiah 10:14,הֹבִ֥ישׁ כָּל־צֹורֵ֖ף מִפָּ֑סֶל ,הֹבִ֥ישׁ,κατῃσχύνθη,aorist indc,is put to shame,PRES..IND,"Every man is stupid and without knowledge ; every goldsmith is put to shame by his idols , for his images are false , and there is no breath in them .",is shamed,PRES..IND,Everyone is senseless and without knowledge ; every goldsmith is shamed by his idols . His images are a fraud ; they have no breath in them .
240215,Jeremiah 10:20,אָהֳלִ֣י שֻׁדָּ֔ד ,שֻׁדָּ֔ד,ἐταλαιπώρησεν,aorist indc,is destroyed,PRES..IND,"My tent is destroyed , and all my cords are broken ; my children have gone from me , and they are not ; there is no one to spread my tent again and to set up my curtains .",is destroyed,PRES..IND,My tent is destroyed ; all its ropes are snapped . My sons are gone from me and are no more ; no-one is left now to pitch my tent or to set up my shelter .
240219,Jeremiah 10:20,וְכָל־מֵיתָרַ֖י נִתָּ֑קוּ ,נִתָּ֑קוּ,διεσπάσθησαν,aorist indc,are broken,PRES..IND,"My tent is destroyed , and all my cords are broken ; my children have gone from me , and they are not ; there is no one to spread my tent again and to set up my curtains .",are snapped,PRES..IND,My tent is destroyed ; all its ropes are snapped . My sons are gone from me and are no more ; no-one is left now to pitch my tent or to set up my shelter .
240232,Jeremiah 10:21,כִּ֤י נִבְעֲרוּ֙ הָֽרֹעִ֔ים ,נִבְעֲרוּ֙,ἠφρονεύσαντο,aorist indc,are stupid,PRES..IND,"For the shepherds are stupid and do not inquire of the Lord ; therefore they have not prospered , and all their flock is scattered .",are senseless,PRES..IND,The shepherds are senseless and do not enquire of the LORD ; so they do not prosper and all their flock is scattered .
240247,Jeremiah 10:21,וְכָל־מַרְעִיתָ֖ם נָפֹֽוצָה׃ ס ,נָפֹֽוצָה,διεσκορπίσθησαν,aorist indc,is scattered,PRES..IND,"For the shepherds are stupid and do not inquire of the Lord ; therefore they have not prospered , and all their flock is scattered .",is scattered,PRES..IND,The shepherds are senseless and do not enquire of the LORD ; so they do not prosper and all their flock is scattered .
240307,Jeremiah 10:25,שְׁפֹ֣ךְ חֲמָתְךָ֗ עַל־הַגֹּויִם֙ אֲשֶׁ֣ר לֹֽא־יְדָע֔וּךָ וְעַל֙ מִשְׁפָּחֹ֔ות אֲשֶׁ֥ר בְּשִׁמְךָ֖ לֹ֣א קָרָ֑אוּ ,קָרָ֑אוּ,ἐπεκαλέσαντο,aorist indc,call,PRES..IND,"Pour out your wrath on the nations that know you not , and on the peoples that call not on your name , for they have devoured Jacob ; they have devoured him and consumed him , and have laid waste his habitation .",do call,PRES..IMPV,"Pour out your wrath on the nations that do not acknowledge you , on the peoples who do not call on your name . For they have devoured Jacob ; they have devoured him completely and destroyed his homeland ."
240527,Jeremiah 11:9,נִֽמְצָא־קֶ֨שֶׁר֙ בְּאִ֣ישׁ יְהוּדָ֔ה וּבְיֹשְׁבֵ֖י יְרוּשָׁלִָֽם׃ ,נִֽמְצָא,εὑρέθη,aorist indc,exists,PRES..IND,"Again the Lord said to me , “ A conspiracy exists among the men of Judah and the inhabitants of Jerusalem .",There is,PRES..IND,"Then the LORD said to me , “ There is a conspiracy among the people of Judah and those who live in Jerusalem ."
240849,Jeremiah 12:1,מַדּ֗וּעַ דֶּ֤רֶךְ רְשָׁעִים֙ צָלֵ֔חָה שָׁל֖וּ כָּל־בֹּ֥גְדֵי בָֽגֶד׃ ,שָׁל֖וּ,εὐθήνησαν,aorist indc,do thrive,PRES..IND,"Righteous are you , O Lord , when I complain to you ; yet I would plead my case before you . Why does the way of the wicked prosper ? Why do all who are treacherous thrive ?",do live at ease,,"You are always righteous , O LORD , when I bring a case before you . Yet I would speak with you about your justice : Why does the way of the wicked prosper ? Why do all the faithless live at ease ?"
240855,Jeremiah 12:2,גַּם־שֹׁרָ֔שׁוּ ,שֹׁרָ֔שׁוּ,ἐρριζώθησαν,aorist indc,they take root,PRES..IND,"You plant them , and they take root ; they grow and produce fruit ; you are near in their mouth and far from their heart .",they have taken root,PRES.PERF.IND,"You have planted them , and they have taken root ; they grow and bear fruit . You are always on their lips but far from their hearts ."
240858,Jeremiah 12:2,גַּם־עָ֣שׂוּ פֶ֑רִי ,עָ֣שׂוּ,ἐποίησαν,aorist indc,produce,PRES..IND,"You plant them , and they take root ; they grow and produce fruit ; you are near in their mouth and far from their heart .",bear,PRES..IND,"You have planted them , and they have taken root ; they grow and bear fruit . You are always on their lips but far from their hearts ."
240902,Jeremiah 12:4,מֵרָעַ֣ת יֹֽשְׁבֵי־בָ֗הּ סָפְתָ֤ה בְהֵמֹות֙ וָעֹ֔וף ,סָפְתָ֤ה,ἠφανίσθησαν,aorist indc,are swept away,PRES..IND,"How long will the land mourn and the grass of every field wither ? For the evil of those who dwell in it the beasts and the birds are swept away , because they said , “ He will not see our latter end . ”",have perished,PRES.PERF.IND,"How long will the land lie parched and the grass in every field be withered ? Because those who live in it are wicked , the animals and birds have perished . Moreover , the people are saying , “ He will not see what happens to us . ”"
240949,Jeremiah 12:6,כִּ֧י גַם־אַחֶ֣יךָ וּבֵית־אָבִ֗יךָ גַּם־הֵ֨מָּה֙ בָּ֣גְדוּ בָ֔ךְ גַּם־הֵ֛מָּה קָרְא֥וּ אַחֲרֶ֖יךָ מָלֵ֑א ,קָרְא֥וּ,ἐβόησαν,aorist indc,are in cry,PRES..IND,"For even your brothers and the house of your father , even they have dealt treacherously with you ; they are in full cry after you ; do not believe them , though they speak friendly words to you . ”",have raised a cry,PRES.PERF.IND,"Your brothers , your own family — even they have betrayed you ; they have raised a loud cry against you . Do not trust them , though they speak well of you ."
240980,Jeremiah 12:8,נָתְנָ֥ה עָלַ֛י בְּקֹולָ֖הּ ,נָתְנָ֥ה,ἔδωκεν,aorist indc,she has lifted up,PRES.PERF.IND,My heritage has become to me like a lion in the forest ; she has lifted up her voice against me ; therefore I hate her .,roars,PRES..IND,My inheritance has become to me like a lion in the forest . She roars at me ; therefore I hate her .
240986,Jeremiah 12:8,עַל־כֵּ֥ן שְׂנֵאתִֽיהָ׃ ,שְׂנֵאתִֽיהָ,ἐμίσησα,aorist indc,I hate,PRES..IND,My heritage has become to me like a lion in the forest ; she has lifted up her voice against me ; therefore I hate her .,I hate,PRES..IND,My inheritance has become to me like a lion in the forest . She roars at me ; therefore I hate her .
241025,Jeremiah 12:11,נָשַׁ֨מָּה֙ כָּל־הָאָ֔רֶץ ,נָשַׁ֨מָּה֙,ἠφανίσθη,aorist indc,is made desolate,PRES..IND,"They have made it a desolation ; desolate , it mourns to me . The whole land is made desolate , but no man lays it to heart .",will be laid waste,FUT..IND,"It will be made a wasteland , parched and desolate before me ; the whole land will be laid waste because there is no-one who cares ."
241562,Jeremiah 13:19,עָרֵ֥י הַנֶּ֛גֶב סֻגְּר֖וּ ,סֻגְּר֖וּ,συνεκλείσθησαν,aorist indc,are shut up,PRES..IND,"The cities of the Negeb are shut up , with none to open them ; all Judah is taken into exile , wholly taken into exile .",will be shut up,FUT..IND,"The cities in the Negev will be shut up , and there will be no-one to open them . All Judah will be carried into exile , carried completely away ."
241566,Jeremiah 13:19,הָגְלָ֧ת יְהוּדָ֛ה כֻּלָּ֖הּ ,הָגְלָ֧ת,ἀπῳκίσθη,aorist indc,is taken into exile,PRES..IND,"The cities of the Negeb are shut up , with none to open them ; all Judah is taken into exile , wholly taken into exile .",will be carried into exile,FUT..IND,"The cities in the Negev will be shut up , and there will be no-one to open them . All Judah will be carried into exile , carried completely away ."
241617,Jeremiah 13:22,בְּרֹ֧ב עֲוֹנֵ֛ךְ נִגְל֥וּ שׁוּלַ֖יִךְ ,נִגְל֥וּ,ἀνεκαλύφθη,aorist indc,are lifted up,PRES..IND,"And if you say in your heart , ‘ Why have these things come upon me ? ’ it is for the greatness of your iniquity that your skirts are lifted up and you suffer violence .",have been torn off,PRES.PERF.IND,"And if you ask yourself , “ Why has this happened to me ? ” — it is because of your many sins that your skirts have been torn off and your body ill-treated ."
241690,Jeremiah 14:1,אֲשֶׁ֨ר הָיָ֤ה דְבַר־יְהוָה֙ אֶֽל־יִרְמְיָ֔הוּ עַל־דִּבְרֵ֖י הַבַּצָּרֹֽות׃ ,הָיָ֤ה,ἐγένετο,aorist indc,came,PAST..IND,The word of the Lord that came to Jeremiah concerning the drought :,is,PRES..IND,This is the word of the LORD to Jeremiah concerning the drought :
241703,Jeremiah 14:2,וּשְׁעָרֶ֥יהָ אֻמְלְל֖וּ ,אֻמְלְל֖וּ,ἐκενώθησαν,aorist indc,languish,PRES..IND,"“ Judah mourns , and her gates languish ; her people lament on the ground , and the cry of Jerusalem goes up .",languish,PRES..IND,"“ Judah mourns , her cities languish ; they wail for the land , and a cry goes up from Jerusalem ."
241704,Jeremiah 14:2,קָדְר֣וּ לָאָ֑רֶץ ,קָדְר֣וּ,ἐσκοτώθησαν,aorist indc,her people lament,PRES..IND,"“ Judah mourns , and her gates languish ; her people lament on the ground , and the cry of Jerusalem goes up .",they wail,PRES..IND,"“ Judah mourns , her cities languish ; they wail for the land , and a cry goes up from Jerusalem ."
241711,Jeremiah 14:2,וְצִוְחַ֥ת יְרוּשָׁלִַ֖ם עָלָֽתָה׃ ,עָלָֽתָה,ἀνέβη,aorist indc,goes up,PRES..IND,"“ Judah mourns , and her gates languish ; her people lament on the ground , and the cry of Jerusalem goes up .",goes up,PRES..IND,"“ Judah mourns , her cities languish ; they wail for the land , and a cry goes up from Jerusalem ."
241714,Jeremiah 14:3,וְאַדִּ֣רֵיהֶ֔ם שָׁלְח֥וּ צְעִירֵיהֶ֖ם לַמָּ֑יִם ,שָׁלְח֥וּ,ἀπέστειλαν,aorist indc,send,PRES..IND,Her nobles send their servants for water ; they come to the cisterns ; they find no water ; they return with their vessels empty ; they are ashamed and confounded and cover their heads .,send,PRES..IND,"The nobles send their servants for water ; they go to the cisterns but find no water . They return with their jars unfilled ; dismayed and despairing , they cover their heads ."
