bhsa_node,ref,sentence,text_full,lxx,lxx_tm,esv,esv_TAM,esv_verse,niv,niv_TAM,niv_verse
325576,Psalms 88:4,כִּֽי־שָֽׂבְעָ֣ה בְרָעֹ֣ות נַפְשִׁ֑י וְחַיַּ֗י לִשְׁאֹ֥ול הִגִּֽיעוּ׃ נֶ֭חְשַׁבְתִּי עִם־יֹ֣ורְדֵי בֹ֑ור הָ֝יִ֗יתִי כְּגֶ֣בֶר אֵֽין־אֱיָֽל׃ בַּמֵּתִ֗ים חָ֫פְשִׁ֥י כְּמֹ֤ו חֲלָלִ֨ים׀ שֹׁ֥כְבֵי קֶ֗בֶר אֲשֶׁ֤ר לֹ֣א זְכַרְתָּ֣ם עֹ֑וד וְ֝הֵ֗מָּה מִיָּדְךָ֥ נִגְזָֽרוּ׃ ,הִגִּֽיעוּ,ἤγγισεν,aorist indc,draws near,PRES..IND,"For my soul is full of troubles , and my life draws near to Sheol .",draws near,PRES..IND,For my soul is full of trouble and my life draws near the grave .
325577,Psalms 88:5,כִּֽי־שָֽׂבְעָ֣ה בְרָעֹ֣ות נַפְשִׁ֑י וְחַיַּ֗י לִשְׁאֹ֥ול הִגִּֽיעוּ׃ נֶ֭חְשַׁבְתִּי עִם־יֹ֣ורְדֵי בֹ֑ור הָ֝יִ֗יתִי כְּגֶ֣בֶר אֵֽין־אֱיָֽל׃ בַּמֵּתִ֗ים חָ֫פְשִׁ֥י כְּמֹ֤ו חֲלָלִ֨ים׀ שֹׁ֥כְבֵי קֶ֗בֶר אֲשֶׁ֤ר לֹ֣א זְכַרְתָּ֣ם עֹ֑וד וְ֝הֵ֗מָּה מִיָּדְךָ֥ נִגְזָֽרוּ׃ ,נֶ֭חְשַׁבְתִּי,προσελογίσθην,aorist indc,I am counted,PRES..IND,"I am counted among those who go down to the pit ; I am a man who has no strength ,",I am counted,PRES..IND,I am counted among those who go down to the pit ; I am like a man without strength .
325581,Psalms 88:5,כִּֽי־שָֽׂבְעָ֣ה בְרָעֹ֣ות נַפְשִׁ֑י וְחַיַּ֗י לִשְׁאֹ֥ול הִגִּֽיעוּ׃ נֶ֭חְשַׁבְתִּי עִם־יֹ֣ורְדֵי בֹ֑ור הָ֝יִ֗יתִי כְּגֶ֣בֶר אֵֽין־אֱיָֽל׃ בַּמֵּתִ֗ים חָ֫פְשִׁ֥י כְּמֹ֤ו חֲלָלִ֨ים׀ שֹׁ֥כְבֵי קֶ֗בֶר אֲשֶׁ֤ר לֹ֣א זְכַרְתָּ֣ם עֹ֑וד וְ֝הֵ֗מָּה מִיָּדְךָ֥ נִגְזָֽרוּ׃ ,הָ֝יִ֗יתִי,ἐγενήθην,aorist indc,I am,PRES..IND,"I am counted among those who go down to the pit ; I am a man who has no strength ,",I am,PRES..IND,I am counted among those who go down to the pit ; I am like a man without strength .
325596,Psalms 88:6,כִּֽי־שָֽׂבְעָ֣ה בְרָעֹ֣ות נַפְשִׁ֑י וְחַיַּ֗י לִשְׁאֹ֥ול הִגִּֽיעוּ׃ נֶ֭חְשַׁבְתִּי עִם־יֹ֣ורְדֵי בֹ֑ור הָ֝יִ֗יתִי כְּגֶ֣בֶר אֵֽין־אֱיָֽל׃ בַּמֵּתִ֗ים חָ֫פְשִׁ֥י כְּמֹ֤ו חֲלָלִ֨ים׀ שֹׁ֥כְבֵי קֶ֗בֶר אֲשֶׁ֤ר לֹ֣א זְכַרְתָּ֣ם עֹ֑וד וְ֝הֵ֗מָּה מִיָּדְךָ֥ נִגְזָֽרוּ׃ ,זְכַרְתָּ֣ם,ἐμνήσθης,aorist indc,you remember,PRES..IND,"like one set loose among the dead , like the slain that lie in the grave , like those whom you remember no more , for they are cut off from your hand .",you remember,PRES..IND,"I am set apart with the dead , like the slain who lie in the grave , whom you remember no more , who are cut off from your care ."
325602,Psalms 88:6,כִּֽי־שָֽׂבְעָ֣ה בְרָעֹ֣ות נַפְשִׁ֑י וְחַיַּ֗י לִשְׁאֹ֥ול הִגִּֽיעוּ׃ נֶ֭חְשַׁבְתִּי עִם־יֹ֣ורְדֵי בֹ֑ור הָ֝יִ֗יתִי כְּגֶ֣בֶר אֵֽין־אֱיָֽל׃ בַּמֵּתִ֗ים חָ֫פְשִׁ֥י כְּמֹ֤ו חֲלָלִ֨ים׀ שֹׁ֥כְבֵי קֶ֗בֶר אֲשֶׁ֤ר לֹ֣א זְכַרְתָּ֣ם עֹ֑וד וְ֝הֵ֗מָּה מִיָּדְךָ֥ נִגְזָֽרוּ׃ ,נִגְזָֽרוּ,ἀπώσθησαν,aorist indc,are cut off,PRES..IND,"like one set loose among the dead , like the slain that lie in the grave , like those whom you remember no more , for they are cut off from your hand .",are cut off,PRES..IND,"I am set apart with the dead , like the slain who lie in the grave , whom you remember no more , who are cut off from your care ."
325612,Psalms 88:8,עָ֭לַי סָמְכָ֣ה חֲמָתֶ֑ךָ ,סָמְכָ֣ה,ἐπεστηρίχθη,aorist indc,lies heavy,PRES..IND,"Your wrath lies heavy upon me , and you overwhelm me with all your waves . Selah",lies heavily,PRES..IND,Your wrath lies heavily upon me ; you have overwhelmed me with all your waves . Selah
325617,Psalms 88:8,וְכָל־מִ֝שְׁבָּרֶ֗יךָ עִנִּ֥יתָ ,עִנִּ֥יתָ,ἐπήγαγες,aorist indc,you overwhelm,PRES..IND,"Your wrath lies heavy upon me , and you overwhelm me with all your waves . Selah",you have overwhelmed,PRES.PERF.IND,Your wrath lies heavily upon me ; you have overwhelmed me with all your waves . Selah
325630,Psalms 88:10,עֵינִ֥י דָאֲבָ֗ה מִנִּ֫י עֹ֥נִי ,דָאֲבָ֗ה,ἠσθένησαν,aorist indc,grows dim,PRES..IND,"my eye grows dim through sorrow . Every day I call upon you , O Lord ; I spread out my hands to you .",are dim,PRES..IND,"my eyes are dim with grief . I call to you , O LORD , every day ; I spread out my hands to you ."
325633,Psalms 88:10,קְרָאתִ֣יךָ יְהוָ֣ה בְּכָל־יֹ֑ום ,קְרָאתִ֣יךָ,ἐκέκραξα,aorist indc,I call upon,PRES..IND,"my eye grows dim through sorrow . Every day I call upon you , O Lord ; I spread out my hands to you .",I call,PRES..IND,"my eyes are dim with grief . I call to you , O LORD , every day ; I spread out my hands to you ."
325677,Psalms 88:14,וַאֲנִ֤י׀ אֵלֶ֣יךָ יְהוָ֣ה שִׁוַּ֑עְתִּי ,שִׁוַּ֑עְתִּי,ἐκέκραξα,aorist indc,cry,PRES..IMPV,"But I , O Lord , cry to you ; in the morning my prayer comes before you .",cry for help,PRES..IND,"But I cry to you for help , O LORD ; in the morning my prayer comes before you ."
325705,Psalms 88:18,סַבּ֣וּנִי כַ֭מַּיִם כָּל־הַיֹּ֑ום ,סַבּ֣וּנִי,ἐκύκλωσάν,aorist indc,They surround,PRES..IND,They surround me like a flood all day long ; they close in on me together .,they surround,PRES..IND,All day long they surround me like a flood ; they have completely engulfed me .
325712,Psalms 88:18,הִקִּ֖יפוּ עָלַ֣י יָֽחַד׃ ,הִקִּ֖יפוּ,περιέσχον,aorist indc,they close in,PRES..IND,They surround me like a flood all day long ; they close in on me together .,they have engulfed,PRES.PERF.IND,All day long they surround me like a flood ; they have completely engulfed me .
326093,Psalms 89:39,הִ֝תְעַבַּ֗רְתָּ עִם־מְשִׁיחֶֽךָ׃ ,הִ֝תְעַבַּ֗רְתָּ,ἀνεβάλου,aorist indc,you are full of wrath,PRES..IND,But now you have cast off and rejected ; you are full of wrath against your anointed .,you have been very angry,PRES.PERF.IND,"But you have rejected , you have spurned , you have been very angry with your anointed one ."
326110,Psalms 89:42,שַׁ֭סֻּהוּ כָּל־עֹ֣בְרֵי דָ֑רֶךְ ,שַׁ֭סֻּהוּ,διήρπασαν,aorist indc,plunder,PRES..IND,All who pass by plunder him ; he has become the scorn of his neighbors .,have plundered,PRES.PERF.IND,All who pass by have plundered him ; he has become the scorn of his neighbors .
326205,Psalms 89:52,זְכֹ֣ר אֲ֭דֹנָי חֶרְפַּ֣ת עֲבָדֶ֑יךָ שְׂאֵתִ֥י בְ֝חֵיקִ֗י כָּל־רַבִּ֥ים עַמִּֽים׃ אֲשֶׁ֤ר חֵרְפ֖וּ אֹויְבֶ֥יךָ׀ יְהוָ֑ה אֲשֶׁ֥ר חֵ֝רְפ֗וּ עִקְּבֹ֥ות מְשִׁיחֶֽךָ׃ ,חֵרְפ֖וּ,ὠνείδισαν,aorist indc,mock,PRES..IND,"with which your enemies mock , O Lord , with which they mock the footsteps of your anointed .",have mocked,PRES.PERF.IND,"the taunts with which your enemies have mocked , O LORD , with which they have mocked every step of your anointed one ."
326209,Psalms 89:52,זְכֹ֣ר אֲ֭דֹנָי חֶרְפַּ֣ת עֲבָדֶ֑יךָ שְׂאֵתִ֥י בְ֝חֵיקִ֗י כָּל־רַבִּ֥ים עַמִּֽים׃ אֲשֶׁ֤ר חֵרְפ֖וּ אֹויְבֶ֥יךָ׀ יְהוָ֑ה אֲשֶׁ֥ר חֵ֝רְפ֗וּ עִקְּבֹ֥ות מְשִׁיחֶֽךָ׃ ,חֵ֝רְפ֗וּ,ὠνείδισαν,aorist indc,they mock,PRES..IND,"with which your enemies mock , O Lord , with which they mock the footsteps of your anointed .",they have mocked,PRES.PERF.IND,"the taunts with which your enemies have mocked , O LORD , with which they have mocked every step of your anointed one ."
326297,Psalms 90:7,כִּֽי־כָלִ֥ינוּ בְאַפֶּ֑ךָ וּֽבַחֲמָתְךָ֥ נִבְהָֽלְנוּ׃ שַׁתָּ֣ה עֲוֹנֹתֵ֣ינוּ לְנֶגְדֶּ֑ךָ עֲ֝לֻמֵ֗נוּ לִמְאֹ֥ור פָּנֶֽיךָ׃ ,כָלִ֥ינוּ,ἐξελίπομεν,aorist indc,we are brought to an end,PRES..IND,For we are brought to an end by your anger ; by your wrath we are dismayed .,We are consumed,PRES..IND,We are consumed by your anger and terrified by your indignation .
326303,Psalms 90:7,כִּֽי־כָלִ֥ינוּ בְאַפֶּ֑ךָ וּֽבַחֲמָתְךָ֥ נִבְהָֽלְנוּ׃ שַׁתָּ֣ה עֲוֹנֹתֵ֣ינוּ לְנֶגְדֶּ֑ךָ עֲ֝לֻמֵ֗נוּ לִמְאֹ֥ור פָּנֶֽיךָ׃ ,נִבְהָֽלְנוּ,ἐταράχθημεν,aorist indc,we are dismayed,PRES..IND,For we are brought to an end by your anger ; by your wrath we are dismayed .,terrified,,We are consumed by your anger and terrified by your indignation .
326315,Psalms 90:9,כִּ֣י כָל־יָ֭מֵינוּ פָּנ֣וּ בְעֶבְרָתֶ֑ךָ כִּלִּ֖ינוּ שָׁנֵ֣ינוּ כְמֹו־הֶֽגֶה׃ יְמֵֽי־שְׁנֹותֵ֨ינוּ בָהֶ֥ם שִׁבְעִ֪ים שָׁנָ֡ה וְשְׁמֹ֘ונִ֤ים שָׁנָ֗ה וְ֭רָהְבָּם עָמָ֣ל וָאָ֑וֶן ,פָּנ֣וּ,ἐξέλιπον,aorist indc,pass away,PRES..IMPV,For all our days pass away under your wrath ; we bring our years to an end like a sigh .,pass away,PRES..IND,All our days pass away under your wrath ; we finish our years with a moan .
326318,Psalms 90:9,כִּ֣י כָל־יָ֭מֵינוּ פָּנ֣וּ בְעֶבְרָתֶ֑ךָ כִּלִּ֖ינוּ שָׁנֵ֣ינוּ כְמֹו־הֶֽגֶה׃ יְמֵֽי־שְׁנֹותֵ֨ינוּ בָהֶ֥ם שִׁבְעִ֪ים שָׁנָ֡ה וְשְׁמֹ֘ונִ֤ים שָׁנָ֗ה וְ֭רָהְבָּם עָמָ֣ל וָאָ֑וֶן ,כִּלִּ֖ינוּ,ἐξελίπομεν,aorist indc,we bring to an end,PRES..IND,For all our days pass away under your wrath ; we bring our years to an end like a sigh .,we finish,PRES..IND,All our days pass away under your wrath ; we finish our years with a moan .
326339,Psalms 90:10,כִּי־גָ֥ז חִ֝֗ישׁ וַנָּעֻֽפָה׃ ,גָ֥ז,ἐπῆλθεν,aorist indc,they are gone,PRES..IND,"The years of our life are seventy , or even by reason of strength eighty ; yet their span is but toil and trouble ; they are soon gone , and we fly away .",they pass,PRES..IND,"The length of our days is seventy years — or eighty , if we have the strength ; yet their span is but trouble and sorrow , for they quickly pass , and we fly away ."
326491,Psalms 91:9,עֶ֝לְיֹ֗ון שַׂ֣מְתָּ מְעֹונֶֽךָ׃ ,שַׂ֣מְתָּ,ἔθου,aorist indc,have made,PRES.PERF.IND,"Because you have made the Lord your dwelling place — the Most High , who is my refuge —",make,PRES..IND,"If you make the Most High your dwelling — even the LORD , who is my refuge —"
326532,Psalms 91:14,כִּ֤י בִ֣י חָ֭שַׁק ,חָ֭שַׁק,ἤλπισεν,aorist indc,he holds fast in love,PRES..IND,"“ Because he holds fast to me in love , I will deliver him ; I will protect him , because he knows my name .",he loves,PRES..IND,"“ Because he loves me , ” says the Lord , “ I will rescue him ; I will protect him , for he acknowledges my name ."
326537,Psalms 91:14,כִּֽי־יָדַ֥ע שְׁמִֽי׃ ,יָדַ֥ע,ἔγνω,aorist indc,he knows,PRES..IND,"“ Because he holds fast to me in love , I will deliver him ; I will protect him , because he knows my name .",he acknowledges,PRES..IND,"“ Because he loves me , ” says the Lord , “ I will rescue him ; I will protect him , for he acknowledges my name ."
326594,Psalms 92:5,כִּ֤י שִׂמַּחְתַּ֣נִי יְהוָ֣ה בְּפָעֳלֶ֑ךָ בְּֽמַעֲשֵׂ֖י יָדֶ֣יךָ אֲרַנֵּֽן׃ ,שִׂמַּחְתַּ֣נִי,εὔφρανάς,aorist indc,you have made glad,PRES.PERF.IND,"For you , O Lord , have made me glad by your work ; at the works of your hands I sing for joy .",you make glad,PRES..IND,"For you make me glad by your deeds , O LORD ; I sing for joy at the works of your hands ."
326607,Psalms 92:6,מְ֝אֹ֗ד עָמְק֥וּ מַחְשְׁבֹתֶֽיךָ׃ ,עָמְק֥וּ,ἐβαθύνθησαν,aorist indc,are very deep,PRES..IND,"How great are your works , O Lord ! Your thoughts are very deep !",profound,,"How great are your works , O LORD , how profound your thoughts !"
326710,Psalms 93:1,יְהוָ֣ה מָלָךְ֮ ,מָלָךְ֮,ἐβασίλευσεν,aorist indc,reigns,PRES..IND,The Lord reigns ; he is robed in majesty ; the lord is robed ; he has put on strength as his belt . Yes the world is established ; it shall never be moved .,reigns,PRES..IND,"The LORD reigns , he is robed in majesty ; the LORD is robed in majesty and is armed with strength . The world is firmly established ; it cannot be moved ."
326712,Psalms 93:1,גֵּא֪וּת לָ֫בֵ֥שׁ ,לָ֫בֵ֥שׁ,ἐνεδύσατο,aorist indc,he is robed,PRES..IND,The Lord reigns ; he is robed in majesty ; the lord is robed ; he has put on strength as his belt . Yes the world is established ; it shall never be moved .,he is robed,PRES..IND,"The LORD reigns , he is robed in majesty ; the LORD is robed in majesty and is armed with strength . The world is firmly established ; it cannot be moved ."
326713,Psalms 93:1,לָבֵ֣שׁ יְ֭הוָה עֹ֣ז ,לָבֵ֣שׁ,ἐνεδύσατο,aorist indc,is robed,PRES..IND,The Lord reigns ; he is robed in majesty ; the lord is robed ; he has put on strength as his belt . Yes the world is established ; it shall never be moved .,is robed,PRES..IND,"The LORD reigns , he is robed in majesty ; the LORD is robed in majesty and is armed with strength . The world is firmly established ; it cannot be moved ."
326716,Psalms 93:1,הִתְאַזָּ֑ר ,הִתְאַזָּ֑ר,περιεζώσατο,aorist indc,he has put on as his belt,PRES.PERF.IND,The Lord reigns ; he is robed in majesty ; the lord is robed ; he has put on strength as his belt . Yes the world is established ; it shall never be moved .,is armed,PRES..IND,"The LORD reigns , he is robed in majesty ; the LORD is robed in majesty and is armed with strength . The world is firmly established ; it cannot be moved ."
327181,Psalms 96:10,יְה֘וָ֤ה מָלָ֗ךְ ,מָלָ֗ךְ,ἐβασίλευσεν,aorist indc,reigns,PRES..IND,"Say among the nations , “ The Lord reigns ! Yes , the world is established ; it shall never be moved ; he will judge the peoples with equity . ”",reigns,PRES..IND,"Say among the nations , “ The LORD reigns . ” The world is firmly established , it cannot be moved ; he will judge the peoples with equity ."
327234,Psalms 97:1,יְהוָ֣ה מָ֭לָךְ ,מָ֭לָךְ,ἐβασίλευσεν,aorist indc,reigns,PRES..IND,"The Lord reigns , let the earth rejoice ; let the many coastlands be glad !",reigns,PRES..IND,"The LORD reigns , let the earth be glad ; let the distant shores rejoice ."
327258,Psalms 97:4,הֵאִ֣ירוּ בְרָקָ֣יו תֵּבֵ֑ל ,הֵאִ֣ירוּ,ἔφαναν,aorist indc,light up,PRES..IND,His lightnings light up the world ; the earth sees and trembles .,lights up,PRES..IND,His lightning lights up the world ; the earth sees and trembles .
327261,Psalms 97:4,רָאֲתָ֖ה וַתָּחֵ֣ל הָאָֽרֶץ׃ ,רָאֲתָ֖ה,εἶδεν,aorist indc,sees,PRES..IND,His lightnings light up the world ; the earth sees and trembles .,sees,PRES..IND,His lightning lights up the world ; the earth sees and trembles .
327282,Psalms 97:6,הִגִּ֣ידוּ הַשָּׁמַ֣יִם צִדְקֹ֑ו ,הִגִּ֣ידוּ,ἀνήγγειλαν,aorist indc,proclaim,PRES..IND,"The heavens proclaim his righteousness , and all the peoples see his glory .",proclaim,PRES..IND,"The heavens proclaim his righteousness , and all the peoples see his glory ."
327287,Psalms 97:6,וְרָא֖וּ כָל־הָעַמִּ֣ים כְּבֹודֹֽו׃ ,רָא֖וּ,εἴδοσαν,aorist indc,see,PRES..IND,"The heavens proclaim his righteousness , and all the peoples see his glory .",see,PRES..IND,"The heavens proclaim his righteousness , and all the peoples see his glory ."
327305,Psalms 97:8,שָׁמְעָ֬ה וַתִּשְׂמַ֨ח׀ צִיֹּ֗ון ,שָׁמְעָ֬ה,ἤκουσεν,aorist indc,hears,PRES..IND,"Zion hears and is glad , and the daughters of Judah rejoice , because of your judgments , O Lord .",hears,PRES..IND,"Zion hears and rejoices and the villages of Judah are glad because of your judgments , O LORD ."
327325,Psalms 97:9,כִּֽי־אַתָּ֤ה יְהוָ֗ה עֶלְיֹ֥ון עַל־כָּל־הָאָ֑רֶץ מְאֹ֥ד נַ֝עֲלֵ֗יתָ עַל־כָּל־אֱלֹהִֽים׃ ,נַ֝עֲלֵ֗יתָ,ὑπερυψώθης,aorist indc,you are exalted,PRES..IND,"For you , O Lord , are most high over all the earth ; you are exalted far above all gods .",you are exalted,PRES..IND,"For you , O LORD , are the Most High over all the earth ; you are exalted far above all gods ."
327462,Psalms 99:1,יְהוָ֣ה מָ֭לָךְ ,מָ֭לָךְ,ἐβασίλευσεν,aorist indc,reigns,PRES..IND,The Lord reigns ; let the peoples tremble ! He sits enthroned upon the cherubim ; let the earth quake !,reigns,PRES..IND,"The LORD reigns , let the nations tremble ; he sits enthroned between the cherubim , let the earth shake ."
327653,Psalms 101:3,עֲשֹֽׂה־סֵטִ֥ים שָׂנֵ֑אתִי ,שָׂנֵ֑אתִי,ἐμίσησα,aorist indc,I hate,PRES..IND,I will not set before my eyes anything that is worthless . I hate the work of those who fall away ; it shall not cling to me .,I hate,PRES..IND,I will set before my eyes no vile thing . The deeds of faithless men I hate ; they will not cling to me .
327756,Psalms 102:4,כִּֽי־כָל֣וּ בְעָשָׁ֣ן יָמָ֑י וְ֝עַצְמֹותַ֗י כְּמֹו־קֵ֥ד נִחָֽרוּ׃ הוּכָּֽה־כָ֭עֵשֶׂב וַיִּבַ֣שׁ לִבִּ֑י ,כָל֣וּ,ἐξέλιπον,aorist indc,pass away,PRES..IMPV,"For my days pass away like smoke , and my bones burn like a furnace .",vanish,PRES..IND,For my days vanish like smoke ; my bones burn like glowing embers .
327764,Psalms 102:4,כִּֽי־כָל֣וּ בְעָשָׁ֣ן יָמָ֑י וְ֝עַצְמֹותַ֗י כְּמֹו־קֵ֥ד נִחָֽרוּ׃ הוּכָּֽה־כָ֭עֵשֶׂב וַיִּבַ֣שׁ לִבִּ֑י ,נִחָֽרוּ,συνεφρύγησαν,aorist indc,burn,PRES..IND,"For my days pass away like smoke , and my bones burn like a furnace .",burn,PRES..IND,For my days vanish like smoke ; my bones burn like glowing embers .
327773,Psalms 102:5,כִּֽי־שָׁ֝כַ֗חְתִּי מֵאֲכֹ֥ל לַחְמִֽי׃ ,שָׁ֝כַ֗חְתִּי,ἐπελαθόμην,aorist indc,I forget,PRES..IND,My heart is struck down like grass and has withered ; I forget to eat my bread .,I forget,PRES..IND,My heart is blighted and withered like grass ; I forget to eat my food .
327780,Psalms 102:6,מִקֹּ֥ול אַנְחָתִ֑י דָּבְקָ֥ה עַ֝צְמִ֗י לִבְשָׂרִֽי׃ ,דָּבְקָ֥ה,ἐκολλήθη,aorist indc,cling,PRES..IND,Because of my loud groaning my bones cling to my flesh .,am reduced,PRES..IND,Because of my loud groaning I am reduced to skin and bones .
327788,Psalms 102:7,הָ֝יִ֗יתִי כְּכֹ֣וס חֳרָבֹֽות׃ ,הָ֝יִ֗יתִי,ἐγενήθην,aorist indc,I am,PRES..IND,"I am like a desert owl of the wilderness , like an owl of the waste places ;",I am,PRES..IND,"I am like a desert owl , like an owl among the ruins ."
327792,Psalms 102:8,שָׁקַ֥דְתִּי ,שָׁקַ֥דְתִּי,ἠγρύπνησα,aorist indc,I lie awake,PRES..IND,I lie awake ; I am like a lonely sparrow on the housetop .,I lie awake,PRES..IND,I lie awake ; I have become like a bird alone on a roof .
327813,Psalms 102:10,כִּי־אֵ֭פֶר כַּלֶּ֣חֶם אָכָ֑לְתִּי וְ֝שִׁקֻּוַ֗י בִּבְכִ֥י מָסָֽכְתִּי׃ מִפְּנֵֽי־זַֽעַמְךָ֥ וְקִצְפֶּ֑ךָ ,אָכָ֑לְתִּי,ἔφαγον,aorist indc,I eat,PRES..IND,"For I eat ashes like bread and mingle tears with my drink ,",I eat,PRES..IND,For I eat ashes as my food and mingle my drink with tears
327862,Psalms 102:15,כִּֽי־רָצ֣וּ עֲ֭בָדֶיךָ אֶת־אֲבָנֶ֑יהָ וְֽאֶת־עֲפָרָ֥הּ יְחֹנֵֽנוּ׃ ,רָצ֣וּ,εὐδόκησαν,aorist indc,hold dear,PRES..IND,For your servants hold her stones dear and have pity on her dust .,are dear,PRES..IND,For her stones are dear to your servants ; her very dust moves them to pity .
327890,Psalms 102:18,כִּֽי־בָנָ֣ה יְהוָ֣ה צִיֹּ֑ון נִ֝רְאָ֗ה בִּכְבֹודֹֽו׃ פָּ֭נָה אֶל־תְּפִלַּ֣ת הָעַרְעָ֑ר וְלֹֽא־בָ֝זָ֗ה אֶת־תְּפִלָּתָֽם׃ ,פָּ֭נָה,ἐπέβλεψεν,aorist indc,he regards,PRES..IND,he regards the prayer of the destitute and does not despise their prayer .,He will respond,FUT..IND,He will respond to the prayer of the destitute ; he will not despise their plea .
327897,Psalms 102:18,כִּֽי־בָנָ֣ה יְהוָ֣ה צִיֹּ֑ון נִ֝רְאָ֗ה בִּכְבֹודֹֽו׃ פָּ֭נָה אֶל־תְּפִלַּ֣ת הָעַרְעָ֑ר וְלֹֽא־בָ֝זָ֗ה אֶת־תְּפִלָּתָֽם׃ ,בָ֝זָ֗ה,ἐξουδένωσεν,aorist indc,does despise,PRES..IND,he regards the prayer of the destitute and does not despise their prayer .,he will despise,FUT..IND,He will respond to the prayer of the destitute ; he will not despise their plea .
328097,Psalms 103:10,לֹ֣א כַ֭חֲטָאֵינוּ עָ֣שָׂה לָ֑נוּ ,עָ֣שָׂה,ἐποίησεν,aorist indc,He does deal,PRES..IND,"He does not deal with us according to our sins , nor repay us according to our iniquities .",he does treat,PRES..IND,he does not treat us as our sins deserve or repay us according to our iniquities .
328121,Psalms 103:12,כִּ֤י כִגְבֹ֣הַּ שָׁ֭מַיִם עַל־הָאָ֑רֶץ גָּבַ֥ר חַ֝סְדֹּ֗ו עַל־יְרֵאָֽיו׃ כִּרְחֹ֣ק מִ֭זְרָח מִֽמַּֽעֲרָ֑ב הִֽרְחִ֥יק מִ֝מֶּ֗נּוּ אֶת־פְּשָׁעֵֽינוּ׃ כְּרַחֵ֣ם אָ֭ב עַל־בָּנִ֑ים רִחַ֥ם יְ֝הוָ֗ה עַל־יְרֵאָֽיו׃ ,הִֽרְחִ֥יק,ἐμάκρυνεν,aorist indc,so far does he remove,PRES..IND,"as far as the east is from the west , so far does he remove our transgressions from us .",so far has he removed,PAST..IND,"as far as the east is from the west , so far has he removed our transgressions from us ."
328130,Psalms 103:13,כִּ֤י כִגְבֹ֣הַּ שָׁ֭מַיִם עַל־הָאָ֑רֶץ גָּבַ֥ר חַ֝סְדֹּ֗ו עַל־יְרֵאָֽיו׃ כִּרְחֹ֣ק מִ֭זְרָח מִֽמַּֽעֲרָ֑ב הִֽרְחִ֥יק מִ֝מֶּ֗נּוּ אֶת־פְּשָׁעֵֽינוּ׃ כְּרַחֵ֣ם אָ֭ב עַל־בָּנִ֑ים רִחַ֥ם יְ֝הוָ֗ה עַל־יְרֵאָֽיו׃ ,רִחַ֥ם,οἰκτίρησεν,aorist indc,shows compassion,PRES..IND,"As a father shows compassion to his children , so the Lord shows compassion to those who fear him .",has compassion,PRES..IND,"As a father has compassion on his children , so the LORD has compassion on those who fear him ;"
328136,Psalms 103:14,כִּי־ה֖וּא יָדַ֣ע יִצְרֵ֑נוּ זָ֝כ֗וּר כִּי־עָפָ֥ר אֲנָֽחְנוּ׃ ,יָדַ֣ע,ἔγνω,aorist indc,knows,PRES..IND,For he knows our frame ; he remembers that we are dust .,knows,PRES..IND,"for he knows how we are formed , he remembers that we are dust ."
328155,Psalms 103:16,כִּ֤י ר֣וּחַ עָֽבְרָה־בֹּ֣ו ,עָֽבְרָה,διῆλθεν,aorist indc,passes,PRES..IND,"for the wind passes over it , and it is gone , and its place knows it no more .",blows,PRES..IND,"the wind blows over it and it is gone , and its place remembers it no more ."
328237,Psalms 104:1,יְהוָ֣ה אֱ֭לֹהַי גָּדַ֣לְתָּ מְּאֹ֑ד ,גָּדַ֣לְתָּ,ἐμεγαλύνθης,aorist indc,you are great,PRES..IND,"Bless the Lord , O my soul ! O Lord my God , you are very great ! You are clothed with splendor and majesty ,",you are great,PRES..IND,"Praise the LORD , O my soul . O LORD my God , you are very great ; you are clothed with splendor and majesty ."
328242,Psalms 104:1,הֹ֭וד וְהָדָ֣ר לָבָֽשְׁתָּ׃ ,לָבָֽשְׁתָּ,ἐνεδύσω,aorist indc,You are clothed,PRES..IND,"Bless the Lord , O my soul ! O Lord my God , you are very great ! You are clothed with splendor and majesty ,",you are clothed,PRES..IND,"Praise the LORD , O my soul . O LORD my God , you are very great ; you are clothed with splendor and majesty ."
