bhsa_node,ref,book,book_super,canon_part,period,genre,domain2,text_full,text_plain,lex,lex_etcbc,gloss,verb_form,stem,person,gender,number,valence,clause_atom,clause,verse,sentence,txt_type,clause_type,cltype_simp,clause_rela,cl_args,is_question,prec_lexes,prec_pos,prec_part,ref_sbl,ref_abbr,has_objc,objc_pos,has_loca,loca_type,loca_heads,has_time
187615,1_Kings 13:33,1_Kings,Kings,Prophets,SBH,prose,D,יהִ֖י,יהי,היה,HJH[,be,jussF,qal,p3,m,sg,--,וִיהִ֖י כֹּהֲנֵ֥י בָמֹֽות׃ ,וִיהִ֖י כֹּהֲנֵ֥י בָמֹֽות׃ ,אַחַר֙ הַדָּבָ֣ר הַזֶּ֔ה לֹֽא־שָׁ֥ב יָרָבְעָ֖ם מִדַּרְכֹּ֣ו הָרָעָ֑ה וַ֠יָּשָׁב וַיַּ֜עַשׂ מִקְצֹ֤ות הָעָם֙ כֹּהֲנֵ֣י בָמֹ֔ות הֶֽחָפֵץ֙ יְמַלֵּ֣א אֶת־יָדֹ֔ו וִיהִ֖י כֹּהֲנֵ֥י בָמֹֽות׃ ,וִיהִ֖י כֹּהֲנֵ֥י בָמֹֽות׃ ,ND,WYqX,W,Main,_W_V,0,_W_,_conj_,_W_,1Kgs 13:33,I Kgs. 13:33,0,,0,,,0
187757,1_Kings 14:5,1_Kings,Kings,Prophets,SBH,prose,Q,יהִ֣י,יהי,היה,HJH[,be,jussF,qal,p3,m,sg,--,וִיהִ֣י ,וִיהִ֣י ,וַיהוָ֞ה אָמַ֣ר אֶל־אֲחִיָּ֗הוּ הִנֵּ֣ה אֵ֣שֶׁת יָרָבְעָ֡ם בָּאָ֣ה לִדְרֹשׁ֩ דָּבָ֨ר מֵעִמְּךָ֤ אֶל־בְּנָהּ֙ כִּֽי־חֹלֶ֣ה ה֔וּא כָּזֹ֥ה וְכָזֶ֖ה תְּדַבֵּ֣ר אֵלֶ֑יהָ וִיהִ֣י כְבֹאָ֔הּ וְהִ֖יא מִתְנַכֵּרָֽה׃ ,וִיהִ֣י כְבֹאָ֔הּ ,?NQ,WYq0,W,Main,_W_V,0,_W_,_conj_,_W_,1Kgs 14:5,I Kgs. 14:5,0,,0,,,0
190255,1_Kings 17:21,1_Kings,Kings,Prophets,SBH,prose,Q,תָּ֥שָׁב,תשׁב,שׁוב,CWB[,return,jussF,qal,p3,f,sg,-c,תָּ֥שָׁב נָ֛א נֶֽפֶשׁ־הַיֶּ֥לֶד הַזֶּ֖ה עַל־קִרְבֹּֽו׃ ,תָּ֥שָׁב נָ֛א נֶֽפֶשׁ־הַיֶּ֥לֶד הַזֶּ֖ה עַל־קִרְבֹּֽו׃ ,וַיִּתְמֹדֵ֤ד עַל־הַיֶּ֨לֶד֙ שָׁלֹ֣שׁ פְּעָמִ֔ים וַיִּקְרָ֥א אֶל־יְהוָ֖ה וַיֹּאמַ֑ר יְהוָ֣ה אֱלֹהָ֔י תָּ֥שָׁב נָ֛א נֶֽפֶשׁ־הַיֶּ֥לֶד הַזֶּ֖ה עַל־קִרְבֹּֽו׃ ,יְהוָ֣ה אֱלֹהָ֔י תָּ֥שָׁב נָ֛א נֶֽפֶשׁ־הַיֶּ֥לֶד הַזֶּ֖ה עַל־קִרְבֹּֽו׃ ,NQ,ZYqX,Ø,Main,V,0,Ø,Ø,Ø,1Kgs 17:21,I Kgs. 17:21,0,,0,,,0
192711,1_Kings 20:32,1_Kings,Kings,Prophets,SBH,prose,Q,תְּחִֽי,תחי,חיה,XJH[,be alive,jussF,qal,p3,f,sg,--,תְּחִֽי־נָ֣א נַפְשִׁ֑י ,תְּחִֽי־נָ֣א נַפְשִׁ֑י ,וַיַּחְגְּרוּ֩ שַׂקִּ֨ים בְּמָתְנֵיהֶ֜ם וַחֲבָלִ֣ים בְּרָאשֵׁיהֶ֗ם וַיָּבֹ֨אוּ֙ אֶל־מֶ֣לֶךְ יִשְׂרָאֵ֔ל וַיֹּ֣אמְר֔וּ עַבְדְּךָ֧ בֶן־הֲדַ֛ד אָמַ֖ר תְּחִֽי־נָ֣א נַפְשִׁ֑י וַיֹּ֛אמֶר הַעֹודֶ֥נּוּ חַ֖י אָחִ֥י הֽוּא׃ ,תְּחִֽי־נָ֣א נַפְשִׁ֑י ,?NQQ,ZYqX,Ø,Main,V,0,Ø,Ø,Ø,1Kgs 20:32,I Kgs. 20:32,0,,0,,,0
193020,1_Kings 21:2,1_Kings,Kings,Prophets,SBH,prose,Q,יהִי,יהי,היה,HJH[,be,jussF,qal,p3,m,sg,-i,וִֽיהִי־לִ֣י לְגַן־יָרָ֗ק ,וִֽיהִי־לִ֣י לְגַן־יָרָ֗ק ,וַיְדַבֵּ֣ר אַחְאָ֣ב אֶל־נָבֹ֣ות׀ לֵאמֹר֩׀ תְּנָה־לִּ֨י אֶֽת־כַּרְמְךָ֜ וִֽיהִי־לִ֣י לְגַן־יָרָ֗ק כִּ֣י ה֤וּא קָרֹוב֙ אֵ֣צֶל בֵּיתִ֔י וְאֶתְּנָ֤ה לְךָ֙ תַּחְתָּ֔יו כֶּ֖רֶם טֹ֣וב מִמֶּ֑נּוּ אִ֚ם טֹ֣וב בְּעֵינֶ֔יךָ אֶתְּנָה־לְךָ֥ כֶ֖סֶף מְחִ֥יר זֶֽה׃ ,וִֽיהִי־לִ֣י לְגַן־יָרָ֗ק ,NQ,WYq0,W,Main,_W_V,0,_W_,_conj_,_W_,1Kgs 21:2,I Kgs. 21:2,0,,0,,,0
193236,1_Kings 21:10,1_Kings,Kings,Prophets,SBH,prose,Q,יָמֹֽת,ימת,מות,MWT[,die,jussF,qal,p3,m,sg,--,וְיָמֹֽת׃ ,וְיָמֹֽת׃ ,וְ֠הֹושִׁיבוּ שְׁנַ֨יִם אֲנָשִׁ֥ים בְּנֵֽי־בְלִיַּעַל֮ נֶגְדֹּו֒ וִיעִדֻ֣הוּ לֵאמֹ֔ר בֵּרַ֥כְתָּ אֱלֹהִ֖ים וָמֶ֑לֶךְ וְהֹוצִיאֻ֥הוּ וְסִקְלֻ֖הוּ וְיָמֹֽת׃ ,וְיָמֹֽת׃ ,NQ,WYq0,W,Main,_W_V,0,_W_,_conj_,_W_,1Kgs 21:10,I Kgs. 21:10,0,,0,,,0
193928,1_Kings 22:13,1_Kings,Kings,Prophets,SBH,prose,Q,יְהִֽי,יהי,היה,HJH[,be,jussF,qal,p3,m,sg,--,יְהִֽי־נָ֣א דְבָרְךָ֗ כִּדְבַ֛ר אַחַ֥ד מֵהֶ֖ם ,יְהִֽי־נָ֣א דְבָרְךָ֗ כִּדְבַ֛ר אַחַ֥ד מֵהֶ֖ם ,וְהַמַּלְאָ֞ךְ אֲשֶׁר־הָלַ֣ךְ׀ לִקְרֹ֣א מִיכָ֗יְהוּ דִּבֶּ֤ר אֵלָיו֙ לֵאמֹ֔ר הִנֵּה־נָ֞א דִּבְרֵ֧י הַנְּבִיאִ֛ים פֶּֽה־אֶחָ֥ד טֹ֖וב אֶל־הַמֶּ֑לֶךְ יְהִֽי־נָ֣א דְבָרְךָ֗ כִּדְבַ֛ר אַחַ֥ד מֵהֶ֖ם וְדִבַּ֥רְתָּ טֹּֽוב׃ ,יְהִֽי־נָ֣א דְבָרְךָ֗ כִּדְבַ֛ר אַחַ֥ד מֵהֶ֖ם ,NQ,ZYqX,Ø,Main,V,0,Ø,Ø,Ø,1Kgs 22:13,I Kgs. 22:13,0,,0,,,0
194084,1_Kings 22:20,1_Kings,Kings,Prophets,SBH,prose,Q,יַ֕עַל,יעל,עלה,<LH[,ascend,jussF,qal,p3,m,sg,--,וְיַ֕עַל ,וְיַ֕עַל ,וַיֹּ֣אמֶר יְהוָ֗ה מִ֤י יְפַתֶּה֙ אֶת־אַחְאָ֔ב וְיַ֕עַל וְיִפֹּ֖ל בְּרָמֹ֣ת גִּלְעָ֑ד וַיֹּ֤אמֶר זֶה֙ בְּכֹ֔ה וְזֶ֥ה אֹמֵ֖ר בְּכֹֽה׃ ,וְיַ֕עַל ,NQNQ,WYq0,W,Main,_W_V,0,_W_,_conj_,_W_,1Kgs 22:20,I Kgs. 22:20,0,,0,,,0
194996,2_Kings 1:10,2_Kings,Kings,Prophets,SBH,prose,Q,תֵּ֤רֶד,תרד,ירד,JRD[,descend,jussF,qal,p3,f,sg,-p,תֵּ֤רֶד אֵשׁ֙ מִן־הַשָּׁמַ֔יִם ,תֵּ֤רֶד אֵשׁ֙ מִן־הַשָּׁמַ֔יִם ,וַיַּעֲנֶ֣ה אֵלִיָּ֗הוּ וַיְדַבֵּר֮ אֶל־שַׂ֣ר הַחֲמִשִּׁים֒ וְאִם־אִ֤ישׁ אֱלֹהִים֙ אָ֔נִי תֵּ֤רֶד אֵשׁ֙ מִן־הַשָּׁמַ֔יִם וְתֹאכַ֥ל אֹתְךָ֖ וְאֶת־חֲמִשֶּׁ֑יךָ וַתֵּ֤רֶד אֵשׁ֙ מִן־הַשָּׁמַ֔יִם וַתֹּ֥אכַל אֹתֹ֖ו וְאֶת־חֲמִשָּֽׁיו׃ ,תֵּ֤רֶד אֵשׁ֙ מִן־הַשָּׁמַ֔יִם ,NQ,ZYqX,Ø,Main,V,0,Ø,Ø,Ø,2Kgs 1:10,II Kgs. 1:10,0,,0,,,0
195054,2_Kings 1:12,2_Kings,Kings,Prophets,SBH,prose,Q,תֵּ֤רֶד,תרד,ירד,JRD[,descend,jussF,qal,p3,f,sg,-p,תֵּ֤רֶד אֵשׁ֙ מִן־הַשָּׁמַ֔יִם ,תֵּ֤רֶד אֵשׁ֙ מִן־הַשָּׁמַ֔יִם ,וַיַּ֣עַן אֵלִיָּה֮ וַיְדַבֵּ֣ר אֲלֵיהֶם֒ אִם־אִ֤ישׁ הָֽאֱלֹהִים֙ אָ֔נִי תֵּ֤רֶד אֵשׁ֙ מִן־הַשָּׁמַ֔יִם וְתֹאכַ֥ל אֹתְךָ֖ וְאֶת־חֲמִשֶּׁ֑יךָ וַתֵּ֤רֶד אֵשׁ־אֱלֹהִים֙ מִן־הַשָּׁמַ֔יִם וַתֹּ֥אכַל אֹתֹ֖ו וְאֶת־חֲמִשָּֽׁיו׃ ,תֵּ֤רֶד אֵשׁ֙ מִן־הַשָּׁמַ֔יִם ,NQ,ZYqX,Ø,Main,V,0,Ø,Ø,Ø,2Kgs 1:12,II Kgs. 1:12,0,,0,,,0
195470,2_Kings 2:9,2_Kings,Kings,Prophets,SBH,prose,Q,יהִי,יהי,היה,HJH[,be,jussF,qal,p3,m,sg,-i,וִֽיהִי־נָ֛א פִּֽי־שְׁנַ֥יִם בְּרוּחֲךָ֖ אֵלָֽי׃ ,וִֽיהִי־נָ֛א פִּֽי־שְׁנַ֥יִם בְּרוּחֲךָ֖ אֵלָֽי׃ ,וַיְהִ֣י כְעָבְרָ֗ם וְאֵ֨לִיָּ֜הוּ אָמַ֤ר אֶל־אֱלִישָׁע֙ שְׁאַל֙ מָ֣ה אֶֽעֱשֶׂה־לָּ֔ךְ בְּטֶ֖רֶם אֶלָּקַ֣ח מֵעִמָּ֑ךְ וַיֹּ֣אמֶר אֱלִישָׁ֔ע וִֽיהִי־נָ֛א פִּֽי־שְׁנַ֥יִם בְּרוּחֲךָ֖ אֵלָֽי׃ ,וִֽיהִי־נָ֛א פִּֽי־שְׁנַ֥יִם בְּרוּחֲךָ֖ אֵלָֽי׃ ,NQ,WYqX,W,Main,_W_V,0,_W_,_conj_,_W_,2Kgs 2:9,II Kgs. 2:9,0,,0,,,0
195488,2_Kings 2:10,2_Kings,Kings,Prophets,SBH,prose,Q,יְהִֽי,יהי,היה,HJH[,be,jussF,qal,p3,m,sg,-i,יְהִֽי־לְךָ֣ כֵ֔ן ,יְהִֽי־לְךָ֣ כֵ֔ן ,וַיֹּ֖אמֶר הִקְשִׁ֣יתָ לִשְׁאֹ֑ול אִם־תִּרְאֶ֨ה אֹתִ֜י לֻקָּ֤ח מֵֽאִתָּךְ֙ יְהִֽי־לְךָ֣ כֵ֔ן וְאִם־אַ֖יִן לֹ֥א יִהְיֶֽה׃ ,יְהִֽי־לְךָ֣ כֵ֔ן ,NQ,ZYq0,Ø,Main,V,0,Ø,Ø,Ø,2Kgs 2:10,II Kgs. 2:10,0,,0,,,0
197700,2_Kings 5:10,2_Kings,Kings,Prophets,SBH,prose,Q,יָשֹׁ֧ב,ישׁב,שׁוב,CWB[,return,jussF,qal,p3,m,sg,-i,וְיָשֹׁ֧ב בְּשָׂרְךָ֛ לְךָ֖ ,וְיָשֹׁ֧ב בְּשָׂרְךָ֛ לְךָ֖ ,וַיִּשְׁלַ֥ח אֵלָ֛יו אֱלִישָׁ֖ע מַלְאָ֣ךְ לֵאמֹ֑ר הָלֹ֗וךְ וְרָחַצְתָּ֤ שֶֽׁבַע־פְּעָמִים֙ בַּיַּרְדֵּ֔ן וְיָשֹׁ֧ב בְּשָׂרְךָ֛ לְךָ֖ וּטְהָֽר׃ ,וְיָשֹׁ֧ב בְּשָׂרְךָ֛ לְךָ֖ ,??NQ,WYqX,W,Main,_W_V,0,_W_,_conj_,_W_,2Kgs 5:10,II Kgs. 5:10,0,,0,,,0
202317,2_Kings 11:12,2_Kings,Kings,Prophets,SBH,prose,Q,יְחִ֥י,יחי,חיה,XJH[,be alive,jussF,qal,p3,m,sg,--,יְחִ֥י הַמֶּֽלֶךְ׃ ס ,יְחִ֥י הַמֶּֽלֶךְ׃ ס ,וַיֹּוצִ֣א אֶת־בֶּן־הַמֶּ֗לֶךְ וַיִּתֵּ֤ן עָלָיו֙ אֶת־הַנֵּ֨זֶר֙ וְאֶת־הָ֣עֵד֔וּת וַיַּמְלִ֥כוּ אֹתֹ֖ו וַיִּמְשָׁחֻ֑הוּ וַיַּכּוּ־כָ֔ף וַיֹּאמְר֖וּ יְחִ֥י הַמֶּֽלֶךְ׃ ס ,יְחִ֥י הַמֶּֽלֶךְ׃ ס ,NQ,ZYqX,Ø,Main,V,0,Ø,Ø,Ø,2Kgs 11:12,II Kgs. 11:12,0,,0,,,0
207616,2_Kings 19:10,2_Kings,Kings,Prophets,SBH,prose,Q,יַשִּׁאֲךָ֣,ישׁאך,נשׁא,NC>=[,beguile,jussF,hif,p3,m,sg,,אַל־יַשִּׁאֲךָ֣ אֱלֹהֶ֔יךָ ,אַל־יַשִּׁאֲךָ֣ אֱלֹהֶ֔יךָ ,כֹּ֣ה תֹאמְר֗וּן אֶל־חִזְקִיָּ֤הוּ מֶֽלֶךְ־יְהוּדָה֙ לֵאמֹ֔ר אַל־יַשִּׁאֲךָ֣ אֱלֹהֶ֔יךָ אֲשֶׁ֥ר אַתָּ֛ה בֹּטֵ֥חַ בֹּ֖ו לֵאמֹ֑ר לֹ֤א תִנָּתֵן֙ יְר֣וּשָׁלִַ֔ם בְּיַ֖ד מֶ֥לֶךְ אַשּֽׁוּר׃ ,אַל־יַשִּׁאֲךָ֣ אֱלֹהֶ֔יךָ אֲשֶׁ֥ר אַתָּ֛ה בֹּטֵ֥חַ בֹּ֖ו לֵאמֹ֑ר ,NQQ,xYqX,x,Main,V,0,_>L=_,_nega_,_>L=_,2Kgs 19:10,II Kgs. 19:10,1,VO?,0,,,0
210383,2_Kings 23:18,2_Kings,Kings,Prophets,SBH,prose,Q,יָנַ֣ע,ינע,נוע,NW<[,quiver,jussF,hif,p3,m,sg,,אִ֖ישׁ אַל־יָנַ֣ע עַצְמֹתָ֑יו ,אִ֖ישׁ אַל־יָנַ֣ע עַצְמֹתָ֑יו ,וַיֹּ֨אמֶר֙ הַנִּ֣יחוּ לֹ֔ו אִ֖ישׁ אַל־יָנַ֣ע עַצְמֹתָ֑יו וַֽיְמַלְּטוּ֙ עַצְמֹתָ֔יו אֵ֚ת עַצְמֹ֣ות הַנָּבִ֔יא אֲשֶׁר־בָּ֖א מִשֹּׁמְרֹֽון׃ ,אִ֖ישׁ אַל־יָנַ֣ע עַצְמֹתָ֑יו ,NQ,XYqt,x,Main,SV,0,_>JC/_>L=_,_subs_nega_,_>L=_,2Kgs 23:18,II Kgs. 23:18,1,VO,0,,,0
220634,Isaiah 27:5,Isaiah,Isaiah,Prophets,,prophetic,D,יַחֲזֵ֣ק,יחזק,חזק,XZQ[,be strong,jussF,hif,p3,m,sg,,אֹ֚ו יַחֲזֵ֣ק בְּמָעוּזִּ֔י ,אֹ֚ו יַחֲזֵ֣ק בְּמָעוּזִּ֔י ,אֹ֚ו יַחֲזֵ֣ק בְּמָעוּזִּ֔י יַעֲשֶׂ֥ה שָׁלֹ֖ום לִ֑י שָׁלֹ֖ום יַֽעֲשֶׂה־לִּֽי׃ ,אֹ֚ו יַחֲזֵ֣ק בְּמָעוּזִּ֔י ,D,xYq0,x,Main,CV,0,_>W_,_conj_,_>W_,Isa 27:5,Isa. 27:5,0,,0,,,0
221935,Isaiah 30:8,Isaiah,Isaiah,Prophets,,prophetic,Q,תְהִי֙,תהי,היה,HJH[,be,jussF,qal,p3,f,sg,--,וּתְהִי֙ לְיֹ֣ום אַחֲרֹ֔ון לָעַ֖ד עַד־עֹולָֽם׃ ,וּתְהִי֙ לְיֹ֣ום אַחֲרֹ֔ון לָעַ֖ד עַד־עֹולָֽם׃ ,עַתָּ֗ה בֹּ֣וא כָתְבָ֥הּ עַל־ל֛וּחַ אִתָּ֖ם וְעַל־סֵ֣פֶר חֻקָּ֑הּ וּתְהִי֙ לְיֹ֣ום אַחֲרֹ֔ון לָעַ֖ד עַד־עֹולָֽם׃ ,וּתְהִי֙ לְיֹ֣ום אַחֲרֹ֔ון לָעַ֖ד עַד־עֹולָֽם׃ ,Q,WYq0,W,Main,_W_V,0,_W_,_conj_,_W_,Isa 30:8,Isa. 30:8,0,,0,,,0
223571,Isaiah 35:1,Isaiah,Isaiah,Prophets,,prophetic,D,תָגֵ֧ל,תגל,גיל,GJL[,rejoice,jussF,qal,p3,f,sg,--,וְתָגֵ֧ל עֲרָבָ֛ה ,וְתָגֵ֧ל עֲרָבָ֛ה ,יְשֻׂשׂ֥וּם מִדְבָּ֖ר וְצִיָּ֑ה וְתָגֵ֧ל עֲרָבָ֛ה וְתִפְרַ֖ח כַּחֲבַצָּֽלֶת׃ ,וְתָגֵ֧ל עֲרָבָ֛ה ,D,WYqX,W,Main,_W_V,0,_W_,_conj_,_W_,Isa 35:1,Isa. 35:1,0,,0,,,0
223580,Isaiah 35:2,Isaiah,Isaiah,Prophets,,prophetic,D,תָגֵ֗ל,תגל,גיל,GJL[,rejoice,jussF,qal,p3,f,sg,d-,וְתָגֵ֗ל אַ֚ף גִּילַ֣ת ,וְתָגֵ֗ל אַ֚ף גִּילַ֣ת ,פָּרֹ֨חַ תִּפְרַ֜ח וְתָגֵ֗ל אַ֚ף גִּילַ֣ת וְרַנֵּ֔ן כְּבֹ֤וד הַלְּבָנֹון֙ נִתַּן־לָ֔הּ הֲדַ֥ר הַכַּרְמֶ֖ל וְהַשָּׁרֹ֑ון הֵ֛מָּה יִרְא֥וּ כְבֹוד־יְהוָ֖ה הֲדַ֥ר אֱלֹהֵֽינוּ׃ ס ,וְתָגֵ֗ל אַ֚ף גִּילַ֣ת ,D,WYq0,W,Main,_W_V,0,_W_,_conj_,_W_,Isa 35:2,Isa. 35:2,1,VO,0,,,0
223625,Isaiah 35:4,Isaiah,Isaiah,Prophets,,prophetic,Q,יֹשַׁעֲכֶֽם,ישׁעכם,ישׁע,JC<[,help,jussF,hif,p3,m,sg,,וְיֹשַׁעֲכֶֽם׃ ,וְיֹשַׁעֲכֶֽם׃ ,אִמְרוּ֙ לְנִמְהֲרֵי־לֵ֔ב חִזְק֖וּ אַל־תִּירָ֑אוּ הִנֵּ֤ה אֱלֹֽהֵיכֶם֙ נָקָ֣ם יָבֹ֔וא גְּמ֣וּל אֱלֹהִ֔ים ה֥וּא יָבֹ֖וא וְיֹשַׁעֲכֶֽם׃ ,וְיֹשַׁעֲכֶֽם׃ ,DQQ,WYq0,W,Main,_W_V,0,_W_,_conj_,_W_,Isa 35:4,Isa. 35:4,1,VO?,0,,,0
225367,Isaiah 38:21,Isaiah,Isaiah,Prophets,,prose,Q,יֶֽחִי,יחי,חיה,XJH[,be alive,jussF,qal,p3,m,sg,--,וְיֶֽחִי׃ ,וְיֶֽחִי׃ ,וַיֹּ֣אמֶר יְשַׁעְיָ֔הוּ יִשְׂא֖וּ דְּבֶ֣לֶת תְּאֵנִ֑ים וְיִמְרְח֥וּ עַֽל־הַשְּׁחִ֖ין וְיֶֽחִי׃ ,וְיֶֽחִי׃ ,?NQ,WYq0,W,Main,_W_V,0,_W_,_conj_,_W_,Isa 38:21,Isa. 38:21,0,,0,,,0
228558,Isaiah 47:3,Isaiah,Isaiah,Prophets,,prophetic,Q,תִּגָּל֙,תגל,גלה,GLH[,uncover,jussF,nif,p3,f,sg,,תִּגָּל֙ עֶרְוָתֵ֔ךְ ,תִּגָּל֙ עֶרְוָתֵ֔ךְ ,תִּגָּל֙ עֶרְוָתֵ֔ךְ גַּ֥ם תֵּרָאֶ֖ה חֶרְפָּתֵ֑ךְ נָקָ֣ם אֶקָּ֔ח וְלֹ֥א אֶפְגַּ֖ע אָדָֽם׃ ס ,תִּגָּל֙ עֶרְוָתֵ֔ךְ ,Q,ZYqX,Ø,Main,V,0,Ø,Ø,Ø,Isa 47:3,Isa. 47:3,0,,0,,,0
231117,Isaiah 55:3,Isaiah,Isaiah,Prophets,,prophetic,Q,תְחִ֣י,תחי,חיה,XJH[,be alive,jussF,qal,p3,f,sg,--,וּתְחִ֣י נַפְשְׁכֶ֑ם ,וּתְחִ֣י נַפְשְׁכֶ֑ם ,הַטּ֤וּ אָזְנְכֶם֙ וּלְכ֣וּ אֵלַ֔י שִׁמְע֖וּ וּתְחִ֣י נַפְשְׁכֶ֑ם וְאֶכְרְתָ֤ה לָכֶם֙ בְּרִ֣ית עֹולָ֔ם חַֽסְדֵ֥י דָוִ֖ד הַנֶּאֱמָנִֽים׃ ,וּתְחִ֣י נַפְשְׁכֶ֑ם ,Q,WYqX,W,Main,_W_V,0,_W_,_conj_,_W_,Isa 55:3,Isa. 55:3,0,,0,,,0
231172,Isaiah 55:7,Isaiah,Isaiah,Prophets,,prophetic,Q,יָשֹׁ֤ב,ישׁב,שׁוב,CWB[,return,jussF,qal,p3,m,sg,-c,וְיָשֹׁ֤ב אֶל־יְהוָה֙ ,וְיָשֹׁ֤ב אֶל־יְהוָה֙ ,יַעֲזֹ֤ב רָשָׁע֙ דַּרְכֹּ֔ו וְאִ֥ישׁ אָ֖וֶן מַחְשְׁבֹתָ֑יו וְיָשֹׁ֤ב אֶל־יְהוָה֙ וִֽירַחֲמֵ֔הוּ וְאֶל־אֱלֹהֵ֖ינוּ כִּֽי־יַרְבֶּ֥ה לִסְלֹֽוחַ׃ ,וְיָשֹׁ֤ב אֶל־יְהוָה֙ וְאֶל־אֱלֹהֵ֖ינוּ ,Q,WYq0,W,Main,_W_V,0,_W_,_conj_,_W_,Isa 55:7,Isa. 55:7,0,,0,,,0
233192,Isaiah 61:10,Isaiah,Isaiah,Prophets,,prophetic,Q,תָּגֵ֤ל,תגל,גיל,GJL[,rejoice,jussF,qal,p3,f,sg,-p,תָּגֵ֤ל נַפְשִׁי֙ בֵּֽאלֹהַ֔י ,תָּגֵ֤ל נַפְשִׁי֙ בֵּֽאלֹהַ֔י ,שֹׂ֧ושׂ אָשִׂ֣ישׂ בַּֽיהוָ֗ה תָּגֵ֤ל נַפְשִׁי֙ בֵּֽאלֹהַ֔י כִּ֤י הִלְבִּישַׁ֨נִי֙ בִּגְדֵי־יֶ֔שַׁע מְעִ֥יל צְדָקָ֖ה יְעָטָ֑נִי כֶּֽחָתָן֙ יְכַהֵ֣ן פְּאֵ֔ר וְכַכַּלָּ֖ה תַּעְדֶּ֥ה כֵלֶֽיהָ׃ ,תָּגֵ֤ל נַפְשִׁי֙ בֵּֽאלֹהַ֔י ,Q,ZYqX,Ø,Main,V,0,Ø,Ø,Ø,Isa 61:10,Isa. 61:10,0,,0,,,0
239604,Jeremiah 9:11,Jeremiah,Jeremiah,Prophets,,prophetic,Q,יָבֵ֣ן,יבן,בין,BJN[,understand,jussF,qal,p3,m,sg,d-,וְיָבֵ֣ן אֶת־זֹ֔את ,וְיָבֵ֣ן אֶת־זֹ֔את ,מִֽי־הָאִ֤ישׁ הֶֽחָכָם֙ וְיָבֵ֣ן אֶת־זֹ֔את וַאֲשֶׁ֨ר דִּבֶּ֧ר פִּֽי־יְהוָ֛ה אֵלָ֖יו וְיַגִּדָ֑הּ עַל־מָה֙ אָבְדָ֣ה הָאָ֔רֶץ נִצְּתָ֥ה כַמִּדְבָּ֖ר מִבְּלִ֖י עֹבֵֽר׃ ס ,וְיָבֵ֣ן אֶת־זֹ֔את ,Q,WYq0,W,Main,_W_V,0,_W_,_conj_,_W_,Jer 9:11,Jer. 9:11,1,VO,0,,,0
240953,Jeremiah 12:6,Jeremiah,Jeremiah,Prophets,,prophetic,Q,תַּאֲמֵ֣ן,תאמן,אמן,>MN[,be firm,jussF,hif,p2,m,sg,,אַל־תַּאֲמֵ֣ן בָּ֔ם ,אַל־תַּאֲמֵ֣ן בָּ֔ם ,כִּ֧י גַם־אַחֶ֣יךָ וּבֵית־אָבִ֗יךָ גַּם־הֵ֨מָּה֙ בָּ֣גְדוּ בָ֔ךְ גַּם־הֵ֛מָּה קָרְא֥וּ אַחֲרֶ֖יךָ מָלֵ֑א אַל־תַּאֲמֵ֣ן בָּ֔ם כִּֽי־יְדַבְּר֥וּ אֵלֶ֖יךָ טֹובֹֽות׃ ס ,אַל־תַּאֲמֵ֣ן בָּ֔ם כִּֽי־יְדַבְּר֥וּ אֵלֶ֖יךָ טֹובֹֽות׃ ס ,Q,xYq0,x,Main,V,0,_>L=_,_nega_,_>L=_,Jer 12:6,Jer. 12:6,0,,0,,,0
241342,Jeremiah 13:10,Jeremiah,Jeremiah,Prophets,,prophetic,Q,יהִי֙,יהי,היה,HJH[,be,jussF,qal,p3,m,sg,--,וִיהִי֙ כָּאֵזֹ֣ור הַזֶּ֔ה ,וִיהִי֙ כָּאֵזֹ֣ור הַזֶּ֔ה ,הָעָם֩ הַזֶּ֨ה הָרָ֜ע הַֽמֵּאֲנִ֣ים׀ לִשְׁמֹ֣ועַ אֶת־דְּבָרַ֗י הַהֹֽלְכִים֙ בִּשְׁרִר֣וּת לִבָּ֔ם וַיֵּלְכ֗וּ אַֽחֲרֵי֙ אֱלֹהִ֣ים אֲחֵרִ֔ים לְעָבְדָ֖ם וּלְהִשְׁתַּחֲוֹ֣ת לָהֶ֑ם וִיהִי֙ כָּאֵזֹ֣ור הַזֶּ֔ה אֲשֶׁ֥ר לֹא־יִצְלַ֖ח לַכֹּֽל׃ ,הָעָם֩ הַזֶּ֨ה הָרָ֜ע הַֽמֵּאֲנִ֣ים׀ לִשְׁמֹ֣ועַ אֶת־דְּבָרַ֗י הַהֹֽלְכִים֙ בִּשְׁרִר֣וּת לִבָּ֔ם וַיֵּלְכ֗וּ אַֽחֲרֵי֙ אֱלֹהִ֣ים אֲחֵרִ֔ים לְעָבְדָ֖ם וּלְהִשְׁתַּחֲוֹ֣ת לָהֶ֑ם וִיהִי֙ כָּאֵזֹ֣ור הַזֶּ֔ה אֲשֶׁ֥ר לֹא־יִצְלַ֖ח לַכֹּֽל׃ ,QNQQ,WYq0,W,Main,_W_V,0,_W_,_conj_,_W_,Jer 13:10,Jer. 13:10,0,,0,,,0
242716,Jeremiah 16:5,Jeremiah,Jeremiah,Prophets,,prophetic,Q,תָּנֹ֖ד,תנד,נוד,NWD[,waver,jussF,qal,p2,m,sg,-i,וְאַל־תָּנֹ֖ד לָהֶ֑ם ,וְאַל־תָּנֹ֖ד לָהֶ֑ם ,כִּֽי־כֹ֣ה׀ אָמַ֣ר יְהוָ֗ה אַל־תָּבֹוא֙ בֵּ֣ית מַרְזֵ֔חַ וְאַל־תֵּלֵ֣ךְ לִסְפֹּ֔וד וְאַל־תָּנֹ֖ד לָהֶ֑ם כִּֽי־אָסַ֨פְתִּי אֶת־שְׁלֹומִ֜י מֵאֵ֨ת הָעָ֤ם־הַזֶּה֙ נְאֻם־יְהוָ֔ה אֶת־הַחֶ֖סֶד וְאֶת־הָֽרַחֲמִֽים׃ ,וְאַל־תָּנֹ֖ד לָהֶ֑ם ,NQQ,WxY0,Wx,Main,_W_V,0,_W_>L=_,_conj_nega_,_W_>L=_,Jer 16:5,Jer. 16:5,0,,0,,,0
244856,Jeremiah 20:14,Jeremiah,Jeremiah,Prophets,,prophetic,N,יְהִ֥י,יהי,היה,HJH[,be,jussF,qal,p3,m,sg,--,אַל־יְהִ֥י בָרֽוּךְ׃ ,אַל־יְהִ֥י בָרֽוּךְ׃ ,אָר֣וּר הַיֹּ֔ום אֲשֶׁ֥ר יֻלַּ֖דְתִּי בֹּ֑ו יֹ֛ום אֲשֶׁר־יְלָדַ֥תְנִי אִמִּ֖י אַל־יְהִ֥י בָרֽוּךְ׃ ,יֹ֛ום אֲשֶׁר־יְלָדַ֥תְנִי אִמִּ֖י אַל־יְהִ֥י בָרֽוּךְ׃ ,N,xYq0,x,Main,V,0,_>L=_,_nega_,_>L=_,Jer 20:14,Jer. 20:14,0,,0,,,0
246302,Jeremiah 23:18,Jeremiah,Jeremiah,Prophets,,prophetic,Q,יֵ֖רֶא,ירא,ראה,R>H[,see,jussF,qal,p3,m,sg,--,וְיֵ֖רֶא ,וְיֵ֖רֶא ,כִּ֣י מִ֤י עָמַד֙ בְּסֹ֣וד יְהוָ֔ה וְיֵ֖רֶא וְיִשְׁמַ֣ע אֶת־דְּבָרֹ֑ו מִֽי־הִקְשִׁ֥יב דְּבָרֹ֖ו וַיִּשְׁמָֽע׃ ס ,וְיֵ֖רֶא ,?Q,WYq0,W,Main,_W_V,0,_W_,_conj_,_W_,Jer 23:18,Jer. 23:18,0,,0,,,0
249202,Jeremiah 28:6,Jeremiah,Jeremiah,Prophets,,prophetic,Q,יָקֵ֤ם,יקם,קום,QWM[,arise,jussF,hif,p3,m,sg,,יָקֵ֤ם יְהוָה֙ אֶת־דְּבָרֶ֔יךָ ,יָקֵ֤ם יְהוָה֙ אֶת־דְּבָרֶ֔יךָ ,וַיֹּ֨אמֶר֙ יִרְמְיָ֣ה הַנָּבִ֔יא אָמֵ֕ן כֵּ֖ן יַעֲשֶׂ֣ה יְהוָ֑ה יָקֵ֤ם יְהוָה֙ אֶת־דְּבָרֶ֔יךָ אֲשֶׁ֣ר נִבֵּ֗אתָ לְהָשִׁ֞יב כְּלֵ֤י בֵית־יְהוָה֙ וְכָל־הַגֹּולָ֔ה מִבָּבֶ֖ל אֶל־הַמָּקֹ֥ום הַזֶּֽה׃ ,יָקֵ֤ם יְהוָה֙ אֶת־דְּבָרֶ֔יךָ אֲשֶׁ֣ר נִבֵּ֗אתָ לְהָשִׁ֞יב כְּלֵ֤י בֵית־יְהוָה֙ וְכָל־הַגֹּולָ֔ה מִבָּבֶ֖ל אֶל־הַמָּקֹ֥ום הַזֶּֽה׃ ,NQ,ZYqX,Ø,Main,V,0,Ø,Ø,Ø,Jer 28:6,Jer. 28:6,1,VO,0,,,0
256162,Jeremiah 38:20,Jeremiah,Jeremiah,Prophets,,prophetic,Q,תְחִ֥י,תחי,חיה,XJH[,be alive,jussF,qal,p3,f,sg,--,וּתְחִ֥י נַפְשֶֽׁךָ׃ ,וּתְחִ֥י נַפְשֶֽׁךָ׃ ,וַיֹּ֥אמֶר יִרְמְיָ֖הוּ לֹ֣א יִתֵּ֑נוּ שְֽׁמַֽע־נָ֣א׀ בְּקֹ֣ול יְהוָ֗ה לַאֲשֶׁ֤ר אֲנִי֙ דֹּבֵ֣ר אֵלֶ֔יךָ וְיִ֥יטַב לְךָ֖ וּתְחִ֥י נַפְשֶֽׁךָ׃ ,וּתְחִ֥י נַפְשֶֽׁךָ׃ ,NQ,WYqX,W,Main,_W_V,0,_W_,_conj_,_W_,Jer 38:20,Jer. 38:20,0,,0,,,0
256625,Jeremiah 39:12,Jeremiah,Jeremiah,Prophets,,prose,Q,תַּ֥עַשׂ,תעשׂ,עשׂה,<FH[,make,jussF,qal,p2,m,sg,di,וְאַל־תַּ֥עַשׂ לֹ֖ו מְא֣וּמָה רָּ֑ע ,וְאַל־תַּ֥עַשׂ לֹ֖ו מְא֣וּמָה רָּ֑ע ,קָחֶ֗נּוּ וְעֵינֶ֨יךָ֙ שִׂ֣ים עָלָ֔יו וְאַל־תַּ֥עַשׂ לֹ֖ו מְא֣וּמָה רָּ֑ע כִּ֗י כַּֽאֲשֶׁר֙ יְדַבֵּ֣ר אֵלֶ֔יךָ כֵּ֖ן עֲשֵׂ֥ה עִמֹּֽו׃ ,וְאַל־תַּ֥עַשׂ לֹ֖ו מְא֣וּמָה רָּ֑ע ,?NQ,WxY0,Wx,Main,_W_V,0,_W_>L=_,_conj_nega_,_W_>L=_,Jer 39:12,Jer. 39:12,1,VO,0,,,0
257850,Jeremiah 42:3,Jeremiah,Jeremiah,Prophets,,prophetic,Q,יַגֶּד,יגד,נגד,NGD[,report,jussF,hif,p3,m,sg,,וְיַגֶּד־לָ֨נוּ֙ יְהוָ֣ה אֱלֹהֶ֔יךָ אֶת־הַדֶּ֖רֶךְ ,וְיַגֶּד־לָ֨נוּ֙ יְהוָ֣ה אֱלֹהֶ֔יךָ אֶת־הַדֶּ֖רֶךְ וְאֶת־הַדָּבָ֖ר ,וְיַגֶּד־לָ֨נוּ֙ יְהוָ֣ה אֱלֹהֶ֔יךָ אֶת־הַדֶּ֖רֶךְ אֲשֶׁ֣ר נֵֽלֶךְ־בָּ֑הּ וְאֶת־הַדָּבָ֖ר אֲשֶׁ֥ר נַעֲשֶֽׂה׃ ,וְיַגֶּד־לָ֨נוּ֙ יְהוָ֣ה אֱלֹהֶ֔יךָ אֶת־הַדֶּ֖רֶךְ אֲשֶׁ֣ר נֵֽלֶךְ־בָּ֑הּ וְאֶת־הַדָּבָ֖ר אֲשֶׁ֥ר נַעֲשֶֽׂה׃ ,NQ,WYqX,W,Main,_W_V,0,_W_,_conj_,_W_,Jer 42:3,Jer. 42:3,1,VO,0,,,0
257900,Jeremiah 42:5,Jeremiah,Jeremiah,Prophets,,prophetic,Q,יְהִ֤י,יהי,היה,HJH[,be,jussF,qal,p3,m,sg,-i,יְהִ֤י יְהוָה֙ בָּ֔נוּ לְעֵ֖ד אֱמֶ֣ת וְנֶאֱמָ֑ן ,יְהִ֤י יְהוָה֙ בָּ֔נוּ לְעֵ֖ד אֱמֶ֣ת וְנֶאֱמָ֑ן ,וְהֵ֨מָּה֙ אָמְר֣וּ אֶֽל־יִרְמְיָ֔הוּ יְהִ֤י יְהוָה֙ בָּ֔נוּ לְעֵ֖ד אֱמֶ֣ת וְנֶאֱמָ֑ן אִם־לֹ֡א כְּֽכָל־הַ֠דָּבָר אֲשֶׁ֨ר יִֽשְׁלָחֲךָ֜ יְהוָ֧ה אֱלֹהֶ֛יךָ אֵלֵ֖ינוּ כֵּ֥ן נַעֲשֶֽׂה׃ ,יְהִ֤י יְהוָה֙ בָּ֔נוּ לְעֵ֖ד אֱמֶ֣ת וְנֶאֱמָ֑ן ,NQ,ZYqX,Ø,Main,V,0,Ø,Ø,Ø,Jer 42:5,Jer. 42:5,0,,0,,,0
262358,Jeremiah 50:26,Jeremiah,Jeremiah,Prophets,,prophetic,Q,תְּהִי,תהי,היה,HJH[,be,jussF,qal,p3,f,sg,-i,אַל־תְּהִי־לָ֖הּ שְׁאֵרִֽית׃ ,אַל־תְּהִי־לָ֖הּ שְׁאֵרִֽית׃ ,בֹּֽאוּ־לָ֤הּ מִקֵּץ֙ פִּתְח֣וּ מַאֲבֻסֶ֔יהָ סָלּ֥וּהָ כְמֹו־עֲרֵמִ֖ים וְהַחֲרִימ֑וּהָ אַל־תְּהִי־לָ֖הּ שְׁאֵרִֽית׃ ,אַל־תְּהִי־לָ֖הּ שְׁאֵרִֽית׃ ,?Q,xYqX,x,Main,V,0,_>L=_,_nega_,_>L=_,Jer 50:26,Jer. 50:26,0,,0,,,0
