bhsa_node,ref,book,book_super,canon_part,period,genre,domain2,text_full,text_plain,lex,lex_etcbc,gloss,verb_form,stem,person,gender,number,valence,clause_atom,clause,verse,sentence,txt_type,clause_type,cltype_simp,clause_rela,cl_args,is_question,prec_lexes,prec_pos,prec_part,ref_sbl,ref_abbr,has_objc,objc_pos,has_loca,loca_type,loca_heads,has_time
35,Genesis 1:3,Genesis,Genesis,Law,SBH,prose,Q,יְהִ֣י,יהי,היה,HJH[,be,jussF,qal,p3,m,sg,--,יְהִ֣י אֹ֑ור ,יְהִ֣י אֹ֑ור ,וַיֹּ֥אמֶר אֱלֹהִ֖ים יְהִ֣י אֹ֑ור וַֽיְהִי־אֹֽור׃ ,יְהִ֣י אֹ֑ור ,?NQ,ZYqX,Ø,Main,V,0,Ø,Ø,Ø,Gen 1:3,Gen. 1:3,0,,0,,,0
82,Genesis 1:6,Genesis,Genesis,Law,SBH,prose,Q,יְהִ֥י,יהי,היה,HJH[,be,jussF,qal,p3,m,sg,--,יְהִ֥י רָקִ֖יעַ בְּתֹ֣וךְ הַמָּ֑יִם ,יְהִ֥י רָקִ֖יעַ בְּתֹ֣וךְ הַמָּ֑יִם ,וַיֹּ֣אמֶר אֱלֹהִ֔ים יְהִ֥י רָקִ֖יעַ בְּתֹ֣וךְ הַמָּ֑יִם וִיהִ֣י מַבְדִּ֔יל בֵּ֥ין מַ֖יִם לָמָֽיִם׃ ,יְהִ֥י רָקִ֖יעַ בְּתֹ֣וךְ הַמָּ֑יִם ,?NQ,ZYqX,Ø,Main,V,0,Ø,Ø,Ø,Gen 1:6,Gen. 1:6,0,,0,,,0
89,Genesis 1:6,Genesis,Genesis,Law,SBH,prose,Q,יהִ֣י,יהי,היה,HJH[,be,jussF,qal,p3,m,sg,-p,וִיהִ֣י מַבְדִּ֔יל בֵּ֥ין מַ֖יִם לָמָֽיִם׃ ,וִיהִ֣י מַבְדִּ֔יל בֵּ֥ין מַ֖יִם לָמָֽיִם׃ ,וַיֹּ֣אמֶר אֱלֹהִ֔ים יְהִ֥י רָקִ֖יעַ בְּתֹ֣וךְ הַמָּ֑יִם וִיהִ֣י מַבְדִּ֔יל בֵּ֥ין מַ֖יִם לָמָֽיִם׃ ,וִיהִ֣י מַבְדִּ֔יל בֵּ֥ין מַ֖יִם לָמָֽיִם׃ ,?NQ,WYq0,W,Main,_W_V,0,_W_,_conj_,_W_,Gen 1:6,Gen. 1:6,0,,0,,,0
182,Genesis 1:11,Genesis,Genesis,Law,SBH,prose,Q,תַּֽדְשֵׁ֤א,תדשׁא,דשׁא,DC>[,grow green,jussF,hif,p3,f,sg,,תַּֽדְשֵׁ֤א הָאָ֨רֶץ֙ דֶּ֔שֶׁא עֵ֚שֶׂב ,תַּֽדְשֵׁ֤א הָאָ֨רֶץ֙ דֶּ֔שֶׁא עֵ֚שֶׂב עֵ֣ץ פְּרִ֞י ,וַיֹּ֣אמֶר אֱלֹהִ֗ים תַּֽדְשֵׁ֤א הָאָ֨רֶץ֙ דֶּ֔שֶׁא עֵ֚שֶׂב מַזְרִ֣יעַ זֶ֔רַע עֵ֣ץ פְּרִ֞י עֹ֤שֶׂה פְּרִי֙ לְמִינֹ֔ו אֲשֶׁ֥ר זַרְעֹו־בֹ֖ו עַל־הָאָ֑רֶץ וַֽיְהִי־כֵֽן׃ ,תַּֽדְשֵׁ֤א הָאָ֨רֶץ֙ דֶּ֔שֶׁא עֵ֚שֶׂב מַזְרִ֣יעַ זֶ֔רַע עֵ֣ץ פְּרִ֞י עֹ֤שֶׂה פְּרִי֙ לְמִינֹ֔ו אֲשֶׁ֥ר זַרְעֹו־בֹ֖ו עַל־הָאָ֑רֶץ ,?NQ,ZYqX,Ø,Main,V,0,Ø,Ø,Ø,Gen 1:11,Gen. 1:11,1,VO,0,,,0
239,Genesis 1:14,Genesis,Genesis,Law,SBH,prose,Q,יְהִ֤י,יהי,היה,HJH[,be,jussF,qal,p3,m,sg,-p,יְהִ֤י מְאֹרֹת֙ בִּרְקִ֣יעַ הַשָּׁמַ֔יִם ,יְהִ֤י מְאֹרֹת֙ בִּרְקִ֣יעַ הַשָּׁמַ֔יִם ,וַיֹּ֣אמֶר אֱלֹהִ֗ים יְהִ֤י מְאֹרֹת֙ בִּרְקִ֣יעַ הַשָּׁמַ֔יִם לְהַבְדִּ֕יל בֵּ֥ין הַיֹּ֖ום וּבֵ֣ין הַלָּ֑יְלָה וְהָי֤וּ לְאֹתֹת֙ וּלְמֹ֣ועֲדִ֔ים וּלְיָמִ֖ים וְשָׁנִֽים׃ ,יְהִ֤י מְאֹרֹת֙ בִּרְקִ֣יעַ הַשָּׁמַ֔יִם לְהַבְדִּ֕יל בֵּ֥ין הַיֹּ֖ום וּבֵ֣ין הַלָּ֑יְלָה ,?NQ,ZYqX,Ø,Main,V,0,Ø,Ø,Ø,Gen 1:14,Gen. 1:14,0,,1,PP,RQJ</,0
434,Genesis 1:22,Genesis,Genesis,Law,SBH,prose,Q,יִ֥רֶב,ירב,רבה,RBH[,be many,jussF,qal,p3,m,sg,-p,וְהָעֹ֖וף יִ֥רֶב בָּאָֽרֶץ׃ ,וְהָעֹ֖וף יִ֥רֶב בָּאָֽרֶץ׃ ,וַיְבָ֧רֶךְ אֹתָ֛ם אֱלֹהִ֖ים לֵאמֹ֑ר פְּר֣וּ וּרְב֗וּ וּמִלְא֤וּ אֶת־הַמַּ֨יִם֙ בַּיַּמִּ֔ים וְהָעֹ֖וף יִ֥רֶב בָּאָֽרֶץ׃ ,וְהָעֹ֖וף יִ֥רֶב בָּאָֽרֶץ׃ ,?NQ,WXYq,Wx,Main,_W_SV,0,_W_H_<WP/_,_conj_art_subs_,_W_,Gen 1:22,Gen. 1:22,0,,1,PP,>RY/,0
449,Genesis 1:24,Genesis,Genesis,Law,SBH,prose,Q,תֹּוצֵ֨א,תוצא,יצא,JY>[,go out,jussF,hif,p3,f,sg,,תֹּוצֵ֨א הָאָ֜רֶץ נֶ֤פֶשׁ חַיָּה֙ לְמִינָ֔הּ ,תֹּוצֵ֨א הָאָ֜רֶץ נֶ֤פֶשׁ חַיָּה֙ לְמִינָ֔הּ ,וַיֹּ֣אמֶר אֱלֹהִ֗ים תֹּוצֵ֨א הָאָ֜רֶץ נֶ֤פֶשׁ חַיָּה֙ לְמִינָ֔הּ בְּהֵמָ֥ה וָרֶ֛מֶשׂ וְחַֽיְתֹו־אֶ֖רֶץ לְמִינָ֑הּ וַֽיְהִי־כֵֽן׃ ,תֹּוצֵ֨א הָאָ֜רֶץ נֶ֤פֶשׁ חַיָּה֙ לְמִינָ֔הּ בְּהֵמָ֥ה וָרֶ֛מֶשׂ וְחַֽיְתֹו־אֶ֖רֶץ לְמִינָ֑הּ ,?NQ,ZYqX,Ø,Main,V,0,Ø,Ø,Ø,Gen 1:24,Gen. 1:24,1,VO,0,,,0
4496,Genesis 9:26,Genesis,Genesis,Law,SBH,prose,Q,יהִ֥י,יהי,היה,HJH[,be,jussF,qal,p3,m,sg,-i,וִיהִ֥י כְנַ֖עַן עֶ֥בֶד לָֽמֹו׃ ,וִיהִ֥י כְנַ֖עַן עֶ֥בֶד לָֽמֹו׃ ,וַיֹּ֕אמֶר בָּר֥וּךְ יְהֹוָ֖ה אֱלֹ֣הֵי שֵׁ֑ם וִיהִ֥י כְנַ֖עַן עֶ֥בֶד לָֽמֹו׃ ,וִיהִ֥י כְנַ֖עַן עֶ֥בֶד לָֽמֹו׃ ,NQ,WYqX,W,Main,_W_V,0,_W_,_conj_,_W_,Gen 9:26,Gen. 9:26,0,,0,,,0
4500,Genesis 9:27,Genesis,Genesis,Law,SBH,prose,Q,יַ֤פְתְּ,יפת,פתה,PTH=[,be spacious,jussF,hif,p3,m,sg,,יַ֤פְתְּ אֱלֹהִים֙ לְיֶ֔פֶת ,יַ֤פְתְּ אֱלֹהִים֙ לְיֶ֔פֶת ,יַ֤פְתְּ אֱלֹהִים֙ לְיֶ֔פֶת וְיִשְׁכֹּ֖ן בְּאָֽהֳלֵי־שֵׁ֑ם וִיהִ֥י כְנַ֖עַן עֶ֥בֶד לָֽמֹו׃ ,יַ֤פְתְּ אֱלֹהִים֙ לְיֶ֔פֶת ,NQ,ZYqX,Ø,Main,V,0,Ø,Ø,Ø,Gen 9:27,Gen. 9:27,0,,0,,,0
4510,Genesis 9:27,Genesis,Genesis,Law,SBH,prose,Q,יהִ֥י,יהי,היה,HJH[,be,jussF,qal,p3,m,sg,-i,וִיהִ֥י כְנַ֖עַן עֶ֥בֶד לָֽמֹו׃ ,וִיהִ֥י כְנַ֖עַן עֶ֥בֶד לָֽמֹו׃ ,יַ֤פְתְּ אֱלֹהִים֙ לְיֶ֔פֶת וְיִשְׁכֹּ֖ן בְּאָֽהֳלֵי־שֵׁ֑ם וִיהִ֥י כְנַ֖עַן עֶ֥בֶד לָֽמֹו׃ ,וִיהִ֥י כְנַ֖עַן עֶ֥בֶד לָֽמֹו׃ ,NQ,WYqX,W,Main,_W_V,0,_W_,_conj_,_W_,Gen 9:27,Gen. 9:27,0,,0,,,0
6002,Genesis 13:8,Genesis,Genesis,Law,SBH,prose,Q,תְהִ֤י,תהי,היה,HJH[,be,jussF,qal,p3,f,sg,-p,אַל־נָ֨א תְהִ֤י מְרִיבָה֙ בֵּינִ֣י וּבֵינֶ֔יךָ וּבֵ֥ין רֹעַ֖י וּבֵ֣ין רֹעֶ֑יךָ ,אַל־נָ֨א תְהִ֤י מְרִיבָה֙ בֵּינִ֣י וּבֵינֶ֔יךָ וּבֵ֥ין רֹעַ֖י וּבֵ֣ין רֹעֶ֑יךָ ,וַיֹּ֨אמֶר אַבְרָ֜ם אֶל־לֹ֗וט אַל־נָ֨א תְהִ֤י מְרִיבָה֙ בֵּינִ֣י וּבֵינֶ֔יךָ וּבֵ֥ין רֹעַ֖י וּבֵ֣ין רֹעֶ֑יךָ כִּֽי־אֲנָשִׁ֥ים אַחִ֖ים אֲנָֽחְנוּ׃ ,אַל־נָ֨א תְהִ֤י מְרִיבָה֙ בֵּינִ֣י וּבֵינֶ֔יךָ וּבֵ֥ין רֹעַ֖י וּבֵ֣ין רֹעֶ֑יךָ ,NQ,xYqX,x,Main,IV,0,_>L=_N>_,_nega_intj_,_>L=_N>_,Gen 13:8,Gen. 13:8,0,,0,,,0
8347,Genesis 18:30,Genesis,Genesis,Law,SBH,prose,Q,יִ֤חַר,יחר,חרה,XRH[,be hot,jussF,qal,p3,m,sg,--,אַל־נָ֞א יִ֤חַר לַֽאדֹנָי֙ ,אַל־נָ֞א יִ֤חַר לַֽאדֹנָי֙ ,וַ֠יֹּאמֶר אַל־נָ֞א יִ֤חַר לַֽאדֹנָי֙ וַאֲדַבֵּ֔רָה אוּלַ֛י יִמָּצְא֥וּן שָׁ֖ם שְׁלֹשִׁ֑ים וַיֹּ֨אמֶר֙ לֹ֣א אֶֽעֱשֶׂ֔ה אִם־אֶמְצָ֥א שָׁ֖ם שְׁלֹשִֽׁים׃ ,אַל־נָ֞א יִ֤חַר לַֽאדֹנָי֙ ,NQ,xYq0,x,Main,IV,0,_>L=_N>_,_nega_intj_,_>L=_N>_,Gen 18:30,Gen. 18:30,0,,0,,,0
8389,Genesis 18:32,Genesis,Genesis,Law,SBH,prose,Q,יִ֤חַר,יחר,חרה,XRH[,be hot,jussF,qal,p3,m,sg,--,אַל־נָ֞א יִ֤חַר לַֽאדֹנָי֙ ,אַל־נָ֞א יִ֤חַר לַֽאדֹנָי֙ ,וַ֠יֹּאמֶר אַל־נָ֞א יִ֤חַר לַֽאדֹנָי֙ וַאֲדַבְּרָ֣ה אַךְ־הַפַּ֔עַם אוּלַ֛י יִמָּצְא֥וּן שָׁ֖ם עֲשָׂרָ֑ה וַיֹּ֨אמֶר֙ לֹ֣א אַשְׁחִ֔ית בַּעֲב֖וּר הָעֲשָׂרָֽה׃ ,אַל־נָ֞א יִ֤חַר לַֽאדֹנָי֙ ,NQ,xYq0,x,Main,IV,0,_>L=_N>_,_nega_intj_,_>L=_N>_,Gen 18:32,Gen. 18:32,0,,0,,,0
8889,Genesis 19:20,Genesis,Genesis,Law,SBH,prose,Q,תְחִ֥י,תחי,חיה,XJH[,be alive,jussF,qal,p3,f,sg,--,וּתְחִ֥י נַפְשִֽׁי׃ ,וּתְחִ֥י נַפְשִֽׁי׃ ,הִנֵּה־נָ֠א הָעִ֨יר הַזֹּ֧את קְרֹבָ֛ה לָנ֥וּס שָׁ֖מָּה וְהִ֣יא מִצְעָ֑ר אִמָּלְטָ֨ה נָּ֜א שָׁ֗מָּה הֲלֹ֥א מִצְעָ֛ר הִ֖וא וּתְחִ֥י נַפְשִֽׁי׃ ,וּתְחִ֥י נַפְשִֽׁי׃ ,NQ,WYqX,W,Main,_W_V,0,_W_,_conj_,_W_,Gen 19:20,Gen. 19:20,0,,0,,,0
10495,Genesis 22:12,Genesis,Genesis,Law,SBH,prose,Q,תַּ֥עַשׂ,תעשׂ,עשׂה,<FH[,make,jussF,qal,p2,m,sg,di,וְאַל־תַּ֥עַשׂ לֹ֖ו מְא֑וּמָּה ,וְאַל־תַּ֥עַשׂ לֹ֖ו מְא֑וּמָּה ,וַיֹּ֗אמֶר אַל־תִּשְׁלַ֤ח יָֽדְךָ֙ אֶל־הַנַּ֔עַר וְאַל־תַּ֥עַשׂ לֹ֖ו מְא֑וּמָּה כִּ֣י׀ עַתָּ֣ה יָדַ֗עְתִּי כִּֽי־יְרֵ֤א אֱלֹהִים֙ אַ֔תָּה וְלֹ֥א חָשַׂ֛כְתָּ אֶת־בִּנְךָ֥ אֶת־יְחִידְךָ֖ מִמֶּֽנִּי׃ ,וְאַל־תַּ֥עַשׂ לֹ֖ו מְא֑וּמָּה ,NQ,WxY0,Wx,Main,_W_V,0,_W_>L=_,_conj_nega_,_W_>L=_,Gen 22:12,Gen. 22:12,1,VO,0,,,0
10869,Genesis 23:9,Genesis,Genesis,Law,SBH,prose,Q,יִתֶּן,יתן,נתן,NTN[,give,jussF,qal,p3,m,sg,di,וְיִתֶּן־לִ֗י אֶת־מְעָרַ֤ת הַמַּכְפֵּלָה֙ ,וְיִתֶּן־לִ֗י אֶת־מְעָרַ֤ת הַמַּכְפֵּלָה֙ ,וְיִתֶּן־לִ֗י אֶת־מְעָרַ֤ת הַמַּכְפֵּלָה֙ אֲשֶׁר־לֹ֔ו אֲשֶׁ֖ר בִּקְצֵ֣ה שָׂדֵ֑הוּ בְּכֶ֨סֶף מָלֵ֜א יִתְּנֶ֥נָּה לִ֛י בְּתֹוכְכֶ֖ם לַאֲחֻזַּת־קָֽבֶר׃ ,וְיִתֶּן־לִ֗י אֶת־מְעָרַ֤ת הַמַּכְפֵּלָה֙ אֲשֶׁר־לֹ֔ו אֲשֶׁ֖ר בִּקְצֵ֣ה שָׂדֵ֑הוּ ,NQ,WYq0,W,Main,_W_V,0,_W_,_conj_,_W_,Gen 23:9,Gen. 23:9,1,VO,0,,,0
12131,Genesis 24:51,Genesis,Genesis,Law,SBH,prose,Q,תְהִ֤י,תהי,היה,HJH[,be,jussF,qal,p3,f,sg,--,וּתְהִ֤י אִשָּׁה֙ לְבֶן־אֲדֹנֶ֔יךָ ,וּתְהִ֤י אִשָּׁה֙ לְבֶן־אֲדֹנֶ֔יךָ ,הִנֵּֽה־רִבְקָ֥ה לְפָנֶ֖יךָ קַ֣ח וָלֵ֑ךְ וּתְהִ֤י אִשָּׁה֙ לְבֶן־אֲדֹנֶ֔יךָ כַּאֲשֶׁ֖ר דִּבֶּ֥ר יְהוָֽה׃ ,וּתְהִ֤י אִשָּׁה֙ לְבֶן־אֲדֹנֶ֔יךָ כַּאֲשֶׁ֖ר דִּבֶּ֥ר יְהוָֽה׃ ,?NQ,WYq0,W,Main,_W_V,0,_W_,_conj_,_W_,Gen 24:51,Gen. 24:51,0,,0,,,0
13502,Genesis 26:28,Genesis,Genesis,Law,SBH,prose,Q,תְּהִ֨י,תהי,היה,HJH[,be,jussF,qal,p3,f,sg,--,תְּהִ֨י נָ֥א אָלָ֛ה בֵּינֹותֵ֖ינוּ בֵּינֵ֣ינוּ וּבֵינֶ֑ךָ ,תְּהִ֨י נָ֥א אָלָ֛ה בֵּינֹותֵ֖ינוּ בֵּינֵ֣ינוּ וּבֵינֶ֑ךָ ,וַיֹּאמְר֗וּ רָאֹ֣ו רָאִינוּ֮ כִּֽי־הָיָ֣ה יְהוָ֣ה׀ עִמָּךְ֒ וַנֹּ֗אמֶר תְּהִ֨י נָ֥א אָלָ֛ה בֵּינֹותֵ֖ינוּ בֵּינֵ֣ינוּ וּבֵינֶ֑ךָ וְנִכְרְתָ֥ה בְרִ֖ית עִמָּֽךְ׃ ,תְּהִ֨י נָ֥א אָלָ֛ה בֵּינֹותֵ֖ינוּ בֵּינֵ֣ינוּ וּבֵינֶ֑ךָ ,NQNQ,ZYqX,Ø,Main,V,0,Ø,Ø,Ø,Gen 26:28,Gen. 26:28,0,,0,,,0
15962,Genesis 30:24,Genesis,Genesis,Law,SBH,prose,Q,יֹסֵ֧ף,יסף,יסף,JSP[,add,jussF,hif,p3,m,sg,,יֹסֵ֧ף יְהוָ֛ה לִ֖י בֵּ֥ן אַחֵֽר׃ ,יֹסֵ֧ף יְהוָ֛ה לִ֖י בֵּ֥ן אַחֵֽר׃ ,וַתִּקְרָ֧א אֶת־שְׁמֹ֛ו יֹוסֵ֖ף לֵאמֹ֑ר יֹסֵ֧ף יְהוָ֛ה לִ֖י בֵּ֥ן אַחֵֽר׃ ,יֹסֵ֧ף יְהוָ֛ה לִ֖י בֵּ֥ן אַחֵֽר׃ ,NQ,ZYqX,Ø,Main,V,0,Ø,Ø,Ø,Gen 30:24,Gen. 30:24,1,VO,0,,,0
16158,Genesis 30:34,Genesis,Genesis,Law,SBH,prose,Q,יְהִ֥י,יהי,היה,HJH[,be,jussF,qal,p3,m,sg,--,ל֖וּ יְהִ֥י כִדְבָרֶֽךָ׃ ,ל֖וּ יְהִ֥י כִדְבָרֶֽךָ׃ ,וַיֹּ֥אמֶר לָבָ֖ן הֵ֑ן ל֖וּ יְהִ֥י כִדְבָרֶֽךָ׃ ,ל֖וּ יְהִ֥י כִדְבָרֶֽךָ׃ ,NQ,xYq0,x,SubAdv,CV,0,_LW_,_conj_,_LW_,Gen 30:34,Gen. 30:34,0,,0,,,0
17033,Genesis 31:35,Genesis,Genesis,Law,SBH,prose,Q,יִ֨חַר֙,יחר,חרה,XRH[,be hot,jussF,qal,p3,m,sg,-p,אַל־יִ֨חַר֙ בְּעֵינֵ֣י אֲדֹנִ֔י ,אַל־יִ֨חַר֙ בְּעֵינֵ֣י אֲדֹנִ֔י ,וַתֹּ֣אמֶר אֶל־אָבִ֗יהָ אַל־יִ֨חַר֙ בְּעֵינֵ֣י אֲדֹנִ֔י כִּ֣י לֹ֤וא אוּכַל֙ לָק֣וּם מִפָּנֶ֔יךָ כִּי־דֶ֥רֶךְ נָשִׁ֖ים לִ֑י וַיְחַפֵּ֕שׂ וְלֹ֥א מָצָ֖א אֶת־הַתְּרָפִֽים׃ ,אַל־יִ֨חַר֙ בְּעֵינֵ֣י אֲדֹנִ֔י ,NQ,xYq0,x,Main,V,0,_>L=_,_nega_,_>L=_,Gen 31:35,Gen. 31:35,0,,0,,,0
17307,Genesis 31:49,Genesis,Genesis,Law,SBH,prose,Q,יִ֥צֶף,יצף,צפה,YPH[,look out,jussF,qal,p3,m,sg,-p,יִ֥צֶף יְהוָ֖ה בֵּינִ֣י וּבֵינֶ֑ךָ ,יִ֥צֶף יְהוָ֖ה בֵּינִ֣י וּבֵינֶ֑ךָ ,וְהַמִּצְפָּה֙ אֲשֶׁ֣ר אָמַ֔ר יִ֥צֶף יְהוָ֖ה בֵּינִ֣י וּבֵינֶ֑ךָ כִּ֥י נִסָּתֵ֖ר אִ֥ישׁ מֵרֵעֵֽהוּ׃ ,יִ֥צֶף יְהוָ֖ה בֵּינִ֣י וּבֵינֶ֑ךָ ,NQ,ZYqX,Ø,Main,V,0,Ø,Ø,Ø,Gen 31:49,Gen. 31:49,0,,0,,,0
18235,Genesis 33:9,Genesis,Genesis,Law,SBH,prose,Q,יְהִ֥י,יהי,היה,HJH[,be,jussF,qal,p3,m,sg,-i,יְהִ֥י לְךָ֖ ,יְהִ֥י לְךָ֖ ,וַיֹּ֥אמֶר עֵשָׂ֖ו יֶשׁ־לִ֣י רָ֑ב אָחִ֕י יְהִ֥י לְךָ֖ אֲשֶׁר־לָֽךְ׃ ,יְהִ֥י לְךָ֖ אֲשֶׁר־לָֽךְ׃ ,NQ,ZYqX,Ø,Main,V,0,Ø,Ø,Ø,Gen 33:9,Gen. 33:9,0,,0,,,0
20671,Genesis 37:27,Genesis,Genesis,Law,SBH,prose,Q,תְּהִי,תהי,היה,HJH[,be,jussF,qal,p3,f,sg,--,וְיָדֵ֨נוּ֙ אַל־תְּהִי־בֹ֔ו ,וְיָדֵ֨נוּ֙ אַל־תְּהִי־בֹ֔ו ,לְכ֞וּ וְנִמְכְּרֶ֣נּוּ לַיִּשְׁמְעֵאלִ֗ים וְיָדֵ֨נוּ֙ אַל־תְּהִי־בֹ֔ו כִּֽי־אָחִ֥ינוּ בְשָׂרֵ֖נוּ ה֑וּא וַֽיִּשְׁמְע֖וּ אֶחָֽיו׃ ,וְיָדֵ֨נוּ֙ אַל־תְּהִי־בֹ֔ו ,NQ,WXYq,Wx,Main,_W_SV,0,_W_JD/_>L=_,_conj_subs_nega_,_W_>L=_,Gen 37:27,Gen. 37:27,0,,0,,,0
22947,Genesis 41:33,Genesis,Genesis,Law,SBH,prose,Q,יֵרֶ֣א,ירא,ראה,R>H[,see,jussF,qal,p3,m,sg,d-,יֵרֶ֣א פַרְעֹ֔ה אִ֖ישׁ נָבֹ֣ון וְחָכָ֑ם ,יֵרֶ֣א פַרְעֹ֔ה אִ֖ישׁ נָבֹ֣ון וְחָכָ֑ם ,וְעַתָּה֙ יֵרֶ֣א פַרְעֹ֔ה אִ֖ישׁ נָבֹ֣ון וְחָכָ֑ם וִישִׁיתֵ֖הוּ עַל־אֶ֥רֶץ מִצְרָֽיִם׃ ,יֵרֶ֣א פַרְעֹ֔ה אִ֖ישׁ נָבֹ֣ון וְחָכָ֑ם ,NQ,ZYqX,Ø,Main,V,0,Ø,Ø,Ø,Gen 41:33,Gen. 41:33,1,VO,0,,,0
22961,Genesis 41:34,Genesis,Genesis,Law,SBH,prose,Q,יַפְקֵ֥ד,יפקד,פקד,PQD[,miss,jussF,hif,p3,m,sg,,וְיַפְקֵ֥ד פְּקִדִ֖ים עַל־הָאָ֑רֶץ ,וְיַפְקֵ֥ד פְּקִדִ֖ים עַל־הָאָ֑רֶץ ,יַעֲשֶׂ֣ה פַרְעֹ֔ה וְיַפְקֵ֥ד פְּקִדִ֖ים עַל־הָאָ֑רֶץ וְחִמֵּשׁ֙ אֶת־אֶ֣רֶץ מִצְרַ֔יִם בְּשֶׁ֖בַע שְׁנֵ֥י הַשָּׂבָֽע׃ ,וְיַפְקֵ֥ד פְּקִדִ֖ים עַל־הָאָ֑רֶץ ,NQ,WYq0,W,Main,_W_V,0,_W_,_conj_,_W_,Gen 41:34,Gen. 41:34,1,VO,0,,,0
25173,Genesis 44:18,Genesis,Genesis,Law,SBH,prose,Q,יִ֥חַר,יחר,חרה,XRH[,be hot,jussF,qal,p3,m,sg,-p,וְאַל־יִ֥חַר אַפְּךָ֖ בְּעַבְדֶּ֑ךָ ,וְאַל־יִ֥חַר אַפְּךָ֖ בְּעַבְדֶּ֑ךָ ,וַיִּגַּ֨שׁ אֵלָ֜יו יְהוּדָ֗ה וַיֹּאמֶר֮ בִּ֣י אֲדֹנִי֒ יְדַבֶּר־נָ֨א עַבְדְּךָ֤ דָבָר֙ בְּאָזְנֵ֣י אֲדֹנִ֔י וְאַל־יִ֥חַר אַפְּךָ֖ בְּעַבְדֶּ֑ךָ כִּ֥י כָמֹ֖וךָ כְּפַרְעֹֽה׃ ,וְאַל־יִ֥חַר אַפְּךָ֖ בְּעַבְדֶּ֑ךָ ,NQ,WxYX,Wx,Main,_W_V,0,_W_>L=_,_conj_nega_,_W_>L=_,Gen 44:18,Gen. 44:18,0,,0,,,0
25418,Genesis 44:33,Genesis,Genesis,Law,SBH,prose,Q,יֵֽשֶׁב,ישׁב,ישׁב,JCB[,sit,jussF,qal,p3,m,sg,--,יֵֽשֶׁב־נָ֤א עַבְדְּךָ֙ תַּ֣חַת הַנַּ֔עַר עֶ֖בֶד לַֽאדֹנִ֑י ,יֵֽשֶׁב־נָ֤א עַבְדְּךָ֙ תַּ֣חַת הַנַּ֔עַר עֶ֖בֶד לַֽאדֹנִ֑י ,וְעַתָּ֗ה יֵֽשֶׁב־נָ֤א עַבְדְּךָ֙ תַּ֣חַת הַנַּ֔עַר עֶ֖בֶד לַֽאדֹנִ֑י וְהַנַּ֖עַר יַ֥עַל עִם־אֶחָֽיו׃ ,יֵֽשֶׁב־נָ֤א עַבְדְּךָ֙ תַּ֣חַת הַנַּ֔עַר עֶ֖בֶד לַֽאדֹנִ֑י ,NQ,ZYqX,Ø,Main,V,0,Ø,Ø,Ø,Gen 44:33,Gen. 44:33,0,,0,,,0
25430,Genesis 44:33,Genesis,Genesis,Law,SBH,prose,Q,יַ֥עַל,יעל,עלה,<LH[,ascend,jussF,qal,p3,m,sg,-c,וְהַנַּ֖עַר יַ֥עַל עִם־אֶחָֽיו׃ ,וְהַנַּ֖עַר יַ֥עַל עִם־אֶחָֽיו׃ ,וְעַתָּ֗ה יֵֽשֶׁב־נָ֤א עַבְדְּךָ֙ תַּ֣חַת הַנַּ֔עַר עֶ֖בֶד לַֽאדֹנִ֑י וְהַנַּ֖עַר יַ֥עַל עִם־אֶחָֽיו׃ ,וְהַנַּ֖עַר יַ֥עַל עִם־אֶחָֽיו׃ ,NQ,WXYq,Wx,Main,_W_SV,0,_W_H_N<R/_,_conj_art_subs_,_W_,Gen 44:33,Gen. 44:33,0,,0,,,0
25540,Genesis 45:5,Genesis,Genesis,Law,SBH,prose,Q,יִ֨חַר֙,יחר,חרה,XRH[,be hot,jussF,qal,p3,m,sg,-p,וְאַל־יִ֨חַר֙ בְּעֵ֣ינֵיכֶ֔ם ,וְאַל־יִ֨חַר֙ בְּעֵ֣ינֵיכֶ֔ם ,וְעַתָּ֣ה׀ אַל־תֵּעָ֣צְב֗וּ וְאַל־יִ֨חַר֙ בְּעֵ֣ינֵיכֶ֔ם כִּֽי־מְכַרְתֶּ֥ם אֹתִ֖י הֵ֑נָּה כִּ֣י לְמִֽחְיָ֔ה שְׁלָחַ֥נִי אֱלֹהִ֖ים לִפְנֵיכֶֽם׃ ,וְאַל־יִ֨חַר֙ בְּעֵ֣ינֵיכֶ֔ם ,?NQ,WxY0,Wx,Main,_W_V,0,_W_>L=_,_conj_nega_,_W_>L=_,Gen 45:5,Gen. 45:5,0,,0,,,0
25830,Genesis 45:20,Genesis,Genesis,Law,SBH,prose,Q,תָּחֹ֖ס,תחס,חוס,XWS[,pity,jussF,qal,p3,f,sg,-c,וְעֵ֣ינְכֶ֔ם אַל־תָּחֹ֖ס עַל־כְּלֵיכֶ֑ם ,וְעֵ֣ינְכֶ֔ם אַל־תָּחֹ֖ס עַל־כְּלֵיכֶ֑ם ,וְעֵ֣ינְכֶ֔ם אַל־תָּחֹ֖ס עַל־כְּלֵיכֶ֑ם כִּי־ט֛וּב כָּל־אֶ֥רֶץ מִצְרַ֖יִם לָכֶ֥ם הֽוּא׃ ,וְעֵ֣ינְכֶ֔ם אַל־תָּחֹ֖ס עַל־כְּלֵיכֶ֑ם ,?NQQ,WXYq,Wx,Main,_W_SV,0,_W_<JN/_>L=_,_conj_subs_nega_,_W_>L=_,Gen 45:20,Gen. 45:20,0,,0,,,0
27823,Genesis 49:4,Genesis,Genesis,Law,SBH,poetry,Q,תֹּותַ֔ר,תותר,יתר,JTR[,remain,jussF,hif,p2,m,sg,,אַל־תֹּותַ֔ר ,אַל־תֹּותַ֔ר ,פַּ֤חַז כַּמַּ֨יִם֙ אַל־תֹּותַ֔ר כִּ֥י עָלִ֖יתָ מִשְׁכְּבֵ֣י אָבִ֑יךָ אָ֥ז חִלַּ֖לְתָּ יְצוּעִ֥י עָלָֽה׃ פ ,אַל־תֹּותַ֔ר ,NQ,xYq0,x,Main,V,0,_>L=_,_nega_,_>L=_,Gen 49:4,Gen. 49:4,0,,0,,,0
31186,Exodus 5:21,Exodus,Exodus,Law,SBH,prose,Q,יֵ֧רֶא,ירא,ראה,R>H[,see,jussF,qal,p3,m,sg,dc,יֵ֧רֶא יְהוָ֛ה עֲלֵיכֶ֖ם ,יֵ֧רֶא יְהוָ֛ה עֲלֵיכֶ֖ם ,וַיֹּאמְר֣וּ אֲלֵהֶ֔ם יֵ֧רֶא יְהוָ֛ה עֲלֵיכֶ֖ם וְיִשְׁפֹּ֑ט אֲשֶׁ֧ר הִבְאַשְׁתֶּ֣ם אֶת־רֵיחֵ֗נוּ בְּעֵינֵ֤י פַרְעֹה֙ וּבְעֵינֵ֣י עֲבָדָ֔יו לָֽתֶת־חֶ֥רֶב בְּיָדָ֖ם לְהָרְגֵֽנוּ׃ ,יֵ֧רֶא יְהוָ֛ה עֲלֵיכֶ֖ם אֲשֶׁ֧ר הִבְאַשְׁתֶּ֣ם אֶת־רֵיחֵ֗נוּ בְּעֵינֵ֤י פַרְעֹה֙ וּבְעֵינֵ֣י עֲבָדָ֔יו לָֽתֶת־חֶ֥רֶב בְּיָדָ֖ם לְהָרְגֵֽנוּ׃ ,?NQ,ZYqX,Ø,Main,V,0,Ø,Ø,Ø,Exod 5:21,Exod. 5:21,0,,0,,,0
31937,Exodus 7:9,Exodus,Exodus,Law,SBH,prose,Q,יְהִ֥י,יהי,היה,HJH[,be,jussF,qal,p3,m,sg,--,יְהִ֥י לְתַנִּֽין׃ ,יְהִ֥י לְתַנִּֽין׃ ,כִּי֩ יְדַבֵּ֨ר אֲלֵכֶ֤ם פַּרְעֹה֙ לֵאמֹ֔ר תְּנ֥וּ לָכֶ֖ם מֹופֵ֑ת וְאָמַרְתָּ֣ אֶֽל־אַהֲרֹ֗ן קַ֧ח אֶֽת־מַטְּךָ֛ וְהַשְׁלֵ֥ךְ לִפְנֵֽי־פַרְעֹ֖ה יְהִ֥י לְתַנִּֽין׃ ,יְהִ֥י לְתַנִּֽין׃ ,NQ,ZYq0,Ø,Main,V,0,Ø,Ø,Ø,Exod 7:9,Exod. 7:9,0,,0,,,0
32466,Exodus 8:4,Exodus,Exodus,Law,SBH,prose,Q,יָסֵר֙,יסר,סור,SWR[,turn aside,jussF,hif,p3,m,sg,,וְיָסֵר֙ הַֽצְפַרְדְּעִ֔ים מִמֶּ֖נִּי וּמֵֽעַמִּ֑י ,וְיָסֵר֙ הַֽצְפַרְדְּעִ֔ים מִמֶּ֖נִּי וּמֵֽעַמִּ֑י ,וַיִּקְרָ֨א פַרְעֹ֜ה לְמֹשֶׁ֣ה וּֽלְאַהֲרֹ֗ן וַיֹּ֨אמֶר֙ הַעְתִּ֣ירוּ אֶל־יְהוָ֔ה וְיָסֵר֙ הַֽצְפַרְדְּעִ֔ים מִמֶּ֖נִּי וּמֵֽעַמִּ֑י וַאֲשַׁלְּחָה֙ אֶת־הָעָ֔ם וְיִזְבְּח֖וּ לַיהוָֽה׃ ,וְיָסֵר֙ הַֽצְפַרְדְּעִ֔ים מִמֶּ֖נִּי וּמֵֽעַמִּ֑י ,NQ,WYq0,W,Main,_W_V,0,_W_,_conj_,_W_,Exod 8:4,Exod. 8:4,1,VO,0,,,0
32961,Exodus 8:25,Exodus,Exodus,Law,SBH,prose,Q,יֹסֵ֤ף,יסף,יסף,JSP[,add,jussF,hif,p3,m,sg,,רַ֗ק אַל־יֹסֵ֤ף פַּרְעֹה֙ ,רַ֗ק אַל־יֹסֵ֤ף פַּרְעֹה֙ ,וַיֹּ֣אמֶר מֹשֶׁ֗ה הִנֵּ֨ה אָנֹכִ֜י יֹוצֵ֤א מֵֽעִמָּךְ֙ וְהַעְתַּרְתִּ֣י אֶל־יְהוָ֔ה וְסָ֣ר הֶעָרֹ֗ב מִפַּרְעֹ֛ה מֵעֲבָדָ֥יו וּמֵעַמֹּ֖ו מָחָ֑ר רַ֗ק אַל־יֹסֵ֤ף פַּרְעֹה֙ הָתֵ֔ל לְבִלְתִּי֙ שַׁלַּ֣ח אֶת־הָעָ֔ם לִזְבֹּ֖חַ לַֽיהוָֽה׃ ,רַ֗ק אַל־יֹסֵ֤ף פַּרְעֹה֙ הָתֵ֔ל לְבִלְתִּי֙ שַׁלַּ֣ח אֶת־הָעָ֔ם לִזְבֹּ֖חַ לַֽיהוָֽה׃ ,NQ,xYqX,x,Main,AV,0,_RQ_>L=_,_advb_nega_,_RQ_>L=_,Exod 8:25,Exod. 8:25,0,,0,,,0
33488,Exodus 9:22,Exodus,Exodus,Law,SBH,prose,Q,יהִ֥י,יהי,היה,HJH[,be,jussF,qal,p3,m,sg,-p,וִיהִ֥י בָרָ֖ד בְּכָל־אֶ֣רֶץ מִצְרָ֑יִם עַל־הָאָדָ֣ם וְעַל־הַבְּהֵמָ֗ה וְעַ֛ל כָּל־עֵ֥שֶׂב הַשָּׂדֶ֖ה בְּאֶ֥רֶץ מִצְרָֽיִם׃ ,וִיהִ֥י בָרָ֖ד בְּכָל־אֶ֣רֶץ מִצְרָ֑יִם עַל־הָאָדָ֣ם וְעַל־הַבְּהֵמָ֗ה וְעַ֛ל כָּל־עֵ֥שֶׂב הַשָּׂדֶ֖ה בְּאֶ֥רֶץ מִצְרָֽיִם׃ ,וַיֹּ֨אמֶר יְהוָ֜ה אֶל־מֹשֶׁה נְטֵ֤ה אֶת־יָֽדְךָ֙ עַל־הַשָּׁמַ֔יִם וִיהִ֥י בָרָ֖ד בְּכָל־אֶ֣רֶץ מִצְרָ֑יִם עַל־הָאָדָ֣ם וְעַל־הַבְּהֵמָ֗ה וְעַ֛ל כָּל־עֵ֥שֶׂב הַשָּׂדֶ֖ה בְּאֶ֥רֶץ מִצְרָֽיִם׃ ,וִיהִ֥י בָרָ֖ד בְּכָל־אֶ֣רֶץ מִצְרָ֑יִם עַל־הָאָדָ֣ם וְעַל־הַבְּהֵמָ֗ה וְעַ֛ל כָּל־עֵ֥שֶׂב הַשָּׂדֶ֖ה בְּאֶ֥רֶץ מִצְרָֽיִם׃ ,NQ,WYqX,W,Main,_W_V,0,_W_,_conj_,_W_,Exod 9:22,Exod. 9:22,0,,1,PP,>RY/,0
34023,Exodus 10:10,Exodus,Exodus,Law,SBH,prose,Q,יְהִ֨י,יהי,היה,HJH[,be,jussF,qal,p3,m,sg,-c,יְהִ֨י כֵ֤ן יְהוָה֙ עִמָּכֶ֔ם ,יְהִ֨י כֵ֤ן יְהוָה֙ עִמָּכֶ֔ם ,וַיֹּ֣אמֶר אֲלֵהֶ֗ם יְהִ֨י כֵ֤ן יְהוָה֙ עִמָּכֶ֔ם כַּאֲשֶׁ֛ר אֲשַׁלַּ֥ח אֶתְכֶ֖ם וְאֶֽת־טַפְּכֶ֑ם רְא֕וּ כִּ֥י רָעָ֖ה נֶ֥גֶד פְּנֵיכֶֽם׃ ,יְהִ֨י כֵ֤ן יְהוָה֙ עִמָּכֶ֔ם כַּאֲשֶׁ֛ר אֲשַׁלַּ֥ח אֶתְכֶ֖ם וְאֶֽת־טַפְּכֶ֑ם ,NQ,ZYqX,Ø,Main,V,0,Ø,Ø,Ø,Exod 10:10,Exod. 10:10,0,,0,,,0
